Full Address,H Status-flag,H Address,H House Number,H Street Name,H City,Address 2,Address 2 House Number,Address 2 Street Name,Address 2 City,new h address-flag,new h house number,new h street name,new h city,new h county,unidentified h info,new h street 1,new h street 2,new h street type,h house number modifier,new address2 house number,new address2 street name,new address2 street 1,new address2 street 2,new address2 street type,new address2 city,new address2 county,unidentified address2 info,address2 house number modifier
Myrtle c Jay h 115 Johnson,Assume,MYRTLE C JAY H 115 JOHNSON,,,MYRTLE C JAY H 115 JOHNSON,,,,,h in between,115,JOHNSON,,,H,,,,,,JAY,,,,,,MYRTLE C,
90 Fulton N Y h 163 Front,Assume,90 FULTON N Y H 163 FRONT,90,FULTON N Y H 163 FRONT,,,,,,h in between,163,FRONT,,,H,,,,,90,FULTON,,,,,,N Y,
Little Dock h 248 Marshall,Assume,LITTLE DOCK H 248 MARSHALL,,,LITTLE DOCK H 248 MARSHALL,,,,,h in between,248,MARSHALL,,,H,,,,,,LITTLE,,,,,,DOCK,
18 South N Y h Schermerhorn n Boerum,Assume,18 SOUTH N Y H SCHERMERHORN N BOERUM,18,SOUTH N Y H SCHERMERHORN N BOERUM,,,,,,h in between,,SCHERMERHORN,,,N BOERUM,,,,,,18,,,,,,SOUTH N Y,
171 Fulton h Myrtle n Classon av,Assume,171 FULTON H MYRTLE N CLASSON AV,171,FULTON H MYRTLE N CLASSON AV,,,,,,h in between,,,,,MYRTLE N CLASSON AV,,,,,171,FULTON,,,,,,,
merchant 116 WallN Y h 6 Joralemon,Assume,MERCHÂT 116 WALLN Y H 6 JORALEMON,116,WALLN Y H 6 JORALEMON,,,,,,h in between,6,JORALEMON,,,H,,,,,116,WALL,,,,,,MERCHÂT  N Y,
Water n Fulton h 106 Bridge,Assume,WATER N FULTON H 106 BRIDGE,,,WATER N FULTON H 106 BRIDGE,,,,,h in between,106,RIDGE,,,B,,,,,,FULTON,,,,,,WATER N,
h 67 Baltic,TRUE,H 67 BALTIC,67,BALTIC,,,,,,start with h,67,BALTIC,,,H,,,,,,,,,,,,,
N Y' h 67 Baltic,Assume,N Y' H 67 BALTIC,,,N Y' H 67 BALTIC,,,,,h in between,67,BALTIC,,,H,,,,,,,,,,,,N Y',
157 Cedar N Y h 67 Baltic,Assume,157 CEDAR N Y H 67 BALTIC,157,CEDAR N Y H 67 BALTIC,,,,,,h in between,67,BALTIC,,,H,,,,,157,CEDAR,,,,,,N Y,
N Y h 8 Willow place,Assume,N Y H 8 WILLOW PLACE,,,N Y H 8 WILLOW PLACE,,,,,h in between,8,WILLOW PL,,,ACE,,,,,,,,,,,,N Y,
Myrtle n Classon av h Classon n Flushing av,Assume,MYRTLE N CLASSON AV H CLASSON N FLUSHING AV,,,MYRTLE N CLASSON AV H CLASSON N FLUSHING AV,,,,,h in between,,,FLUSHING,,CLASSON N  AV,,,,,,,,,,,,MYRTLE N CLASSON AV,
N Y h 45 Willow,Assume,N Y H 45 WILLOW,,,N Y H 45 WILLOW,,,,,h in between,45,WILLOW,,,H,,,,,,,,,,,,N Y,
S Maiden Lane NY h 182 Atlantic,Assume,S MAIDEN LANE NY H 182 ATLANTIC,,,S MAIDEN LANE NY H 182 ATLANTIC,,,,,h in between,182,ATLANTIC,,,H,,,,,,MAIDEN LA,,,,NY,,S NE,
234 Fulton h 28 Everitt,Assume,234 FULTON H 28 EVERITT,234,FULTON H 28 EVERITT,,,,,,h in between,28,EVERITT,,,H,,,,,234,FULTON,,,,,,,
17 Park Place NY h Columbia n Hamilton av,Assume,17 PARK PLACE NY H COLUMBIA N HAMILTON AV,17,PARK PLACE NY H COLUMBIA N HAMILTON AV,,,,,,h in between,,COLUMBIA,,HAMILTON,N  AV,,,,,17,PARK PL,,,,NY,,ACE,
"brown and blue stone yard , Water b Adams and Washington h. 5 Monroe Place",Assume,"BROWN AND BLUE STONE YARD , WATER B ADAMS AND WASHINGTON H. 5 MONROE PLACE",,,"BROWN AND BLUE STONE YARD , WATER B ADAMS AND WASHINGTON H. 5 MONROE PLACE",,,,,h in between,5,MONROE PL,,,ACE,,,,,,WASHINGTON,,,,,,"BROWN AND BLUE STONE YARD , WATER B ADAMS AND",
Columbia c Pacific h Boreum c Schermerhorn,Assume,COLUMBIA C PACIFIC H BOREUM C SCHERMERHORN,,,COLUMBIA C PACIFIC H BOREUM C SCHERMERHORN,,,,,h in between,,SCHERMERHORN,,,BOREUM C,,,,,,COLUMBIA,,,,,,C PACIFIC,
"brown and blue stone yard , Water h YVashington and Adams",Assume,"BROWN AND BLUE STONE YARD , WATER H YVASHINGTON AND ADAMS",,,"BROWN AND BLUE STONE YARD , WATER H YVASHINGTON AND ADAMS",,,,,h in between,,ADAMS,,,YVASHINGTON AND,,,,,,BROWN,,,,,,"AND BLUE STONE YARD , WATER",
Adams c York h 72 Adams,Assume,ADAMS C YORK H 72 ADAMS,,,ADAMS C YORK H 72 ADAMS,,,,,h in between,72,ADAMS,,,H,,,,,,ADAMS,,,,,,C YORK,
24 Cedar N Y h 97 Concord,Assume,24 CEDAR N Y H 97 CONCORD,24,CEDAR N Y H 97 CONCORD,,,,,,h in between,97,CONCORD,,,H,,,,,24,CEDAR,,,,,,N Y,
N Y h 24 Garden,Assume,N Y H 24 GARDEN,,,N Y H 24 GARDEN,,,,,h in between,24,GARDEN,,,H,,,,,,,,,,,,N Y,
Phoenix market Willoughby c Gold h 95 Myrtle av,Assume,PHOENIX MARKET WILLOUGHBY C GOLD H 95 MYRTLE AV,,,PHOENIX MARKET WILLOUGHBY C GOLD H 95 MYRTLE AV,,,,,h in between,,95,,,MYRTLE AV,,,,,,WILLOUGHBY,,,,PHOENIX,,MARKET  C GOLD,
Hudson n Fulton av h 218 Front,Assume,HUDSON N FULTON AV H 218 FRONT,,,HUDSON N FULTON AV H 218 FRONT,,,,,h in between,218,FRONT,,,H,,,,,,HUDSON,,,,,FULTON,N  AV,
159 Pearl N Y h 69 Orange,Assume,159 PEARL N Y H 69 ORANGE,159,PEARL N Y H 69 ORANGE,,,,,,h in between,69,ORANGE,,,H,,,,,159,PEARL,,,,,,N Y,
N Y h 46 Sauds,Assume,N Y H 46 SAUDS,,,N Y H 46 SAUDS,,,,,h in between,,46,,,SAUDS,,,,,,,,,,,,N Y,
60 Pine N Y h 38 Pierrepont,Assume,60 PINE N Y H 38 PIERREPONT,60,PINE N Y H 38 PIERREPONT,,,,,,h in between,38,PIERREPONT,,,H,,,,,60,PINE,,,,,,N Y,
mercht19 Cortlandt N Y h 73 Cranberry,Assume,MERCHT19 CORTLANDT N Y H 73 CRANBERRY,,,MERCHT19 CORTLANDT N Y H 73 CRANBERRY,,,,,h in between,73,CRANBERRY,,,H,,,,,,CORTLANDT,,,,,,MERCHT19  N Y,
34 Beaver N Y h 65 Joralemon,Assume,34 BEAVER N Y H 65 JORALEMON,34,BEAVER N Y H 65 JORALEMON,,,,,,h in between,65,JORALEMON,,,H,,,,,34,BEAVER,,,,,,N Y,
147 Broadway N Y h 100 Middagh,Assume,147 BROADWAY N Y H 100 MIDDAGH,147,BROADWAY N Y H 100 MIDDAGH,,,,,,h in between,100,MIDDAGH,,,H,,,,,147,BROADWAY,,,,,,N Y,
254 Gold n Myrtle av able keeper Fulton n City Hall h 9 Pearl,Assume,254 GOLD N MYRTLE AV ABLE KEEPER FULTON N CITY HALL H 9 PEARL,254,GOLD N MYRTLE AV ABLE KEEPER FULTON N CITY HALL H 9 PEARL,,,,,,h in between,9,PEARL,,,H,,,,,254,FULTON,,,,,,GOLD N MYRTLE AV ABLE KEEPER  N CITY HALL,
Park c Franklin av h Flushing,Assume,PARK C FRANKLIN AV H FLUSHING,,,PARK C FRANKLIN AV H FLUSHING,,,,,h in between,,,FLUSHING,,H,,,,,,FRANKLIN,,,,,,PARK C  AV,
42 Water N Y h 99 Jay,Assume,42 WATER N Y H 99 JAY,42,WATER N Y H 99 JAY,,,,,,h in between,99,JAY,,,H,,,,,42,WATER,,,,,,N Y,
38 South N Y h 9 Monroe place,Assume,38 SOUTH N Y H 9 MONROE PLACE,38,SOUTH N Y H 9 MONROE PLACE,,,,,,h in between,9,MONROE PL,,,ACE,,,,,,38,,,,,,SOUTH N Y,
38 South N Y h 9 Monroe Place,Assume,38 SOUTH N Y H 9 MONROE PLACE,38,SOUTH N Y H 9 MONROE PLACE,,,,,,h in between,9,MONROE PL,,,ACE,,,,,,38,,,,,,SOUTH N Y,
105 Wall N Y h 26 Garden,Assume,105 WALL N Y H 26 GARDEN,105,WALL N Y H 26 GARDEN,,,,,,h in between,26,GARDEN,,,H,,,,,105,WALL,,,,,,N Y,
N Y h 4 Union Place,Assume,N Y H 4 UNION PLACE,,,N Y H 4 UNION PLACE,,,,,h in between,4,UNION PL,,,ACE,,,,,,,,,,,,N Y,
N Y h 41 Livingston,Assume,N Y H 41 LIVINGSTON,,,N Y H 41 LIVINGSTON,,,,,h in between,41,LIVINGSTON,,,H,,,,,,,,,,,,N Y,
N Y h 42 Concord,Assume,N Y H 42 CONCORD,,,N Y H 42 CONCORD,,,,,h in between,42,CONCORD,,,H,,,,,,,,,,,,N Y,
57 Water N Y h 26 Prospect,Assume,57 WATER N Y H 26 PROSPECT,57,WATER N Y H 26 PROSPECT,,,,,,h in between,26,PROSPECT,,,H,,,,,57,WATER,,,,,,N Y,
Furman h 102 Joralemon,Assume,FURMAN H 102 JORALEMON,,,FURMAN H 102 JORALEMON,,,,,h in between,102,JORALEMON,,,H,,,,,,FURMAN,,,,,,,
129 Fulton N Y h 114 Smith,Assume,129 FULTON N Y H 114 SMITH,129,FULTON N Y H 114 SMITH,,,,,,h in between,114,SMITH,,,H,,,,,129,FULTON,,,,,,N Y,
50 South N Y h 74 Pacific n Clinton,Assume,50 SOUTH N Y H 74 PACIFIC N CLINTON,50,SOUTH N Y H 74 PACIFIC N CLINTON,,,,,,h in between,74,PACIFIC,,CLINTON,N,,,,,,50,,,,,,SOUTH N Y,
129 Atlantic c Henry h 131 Columbia,Assume,129 ATLANTIC C HENRY H 131 COLUMBIA,129,ATLANTIC C HENRY H 131 COLUMBIA,,,,,,h in between,131,COLUMBIA,,,H,,,,,129,ATLANTIC,,,,,,C HENRY,
46 Front N Y h 28 Joralemon,Assume,46 FRONT N Y H 28 JORALEMON,46,FRONT N Y H 28 JORALEMON,,,,,,h in between,28,JORALEMON,,,H,,,,,46,FRONT,,,,,,N Y,
Fulton market h 146 Concord,Assume,FULTON MARKET H 146 CONCORD,,,FULTON MARKET H 146 CONCORD,,,,,h in between,146,CONCORD,,,H,,,,,,FULTON MARKET,,,,,,,
157 Fulton n High h 280 Jay,Assume,157 FULTON N HIGH H 280 JAY,157,FULTON N HIGH H 280 JAY,,,,,,h in between,280,JAY,,,H,,,,,157,FULTON,,,,,,N HIGH,
Apothecaries Hall 206 Fulton c Pineapple h 22 Sands,Assume,APOTHECARIES HALL 206 FULTON C PINEAPPLE H 22 SANDS,,,APOTHECARIES HALL 206 FULTON C PINEAPPLE H 22 SANDS,,,,,h in between,22,SANDS,,,H,,,,,,PINEAPPLE,,,,,FULTON,APOTHECARIES HALL 206  C,
157 Fulton h 157 Jay Water,Assume,157 FULTON H 157 JAY WATER,157,FULTON H 157 JAY WATER,,,,,,h in between,157,WATER,,,JAY,,,,,157,FULTON,,,,,,,
47 Cliff N Y h 105 Clinton,Assume,47 CLIFF N Y H 105 CLINTON,47,CLIFF N Y H 105 CLINTON,,,,,,h in between,105,CLINTON,,,H,,,,,47,CLIFF,,,,,,N Y,
6 Linden row Fulton h 20 Willoughby,Assume,6 LINDEN ROW FULTON H 20 WILLOUGHBY,6,LINDEN ROW FULTON H 20 WILLOUGHBY,,,,,,h in between,20,WILLOUGHBY,,,H,,,,,6,LINDEN,,,,W FULTON,,RO,
225 Atlantic h 8 Garden,Assume,225 ATLANTIC H 8 GARDEN,225,ATLANTIC H 8 GARDEN,,,,,,h in between,8,GARDEN,,,H,,,,,225,ATLANTIC,,,,,,,
Pacific n Court h Baltic n Smith,Assume,PACIFIC N COURT H BALTIC N SMITH,,,PACIFIC N COURT H BALTIC N SMITH,,,,,h in between,,BALTIC,,,N SMITH,,,,,,PACIFIC,,,,,,N COURT,
145 Nassau N Y h 13 Schermerhorn,Assume,145 NASSAU N Y H 13 SCHERMERHORN,145,NASSAU N Y H 13 SCHERMERHORN,,,,,,h in between,13,SCHERMERHORN,,,H,,,,,145,NASSAU,,,,,,N Y,
6 Linden row Fulton h 20 Willoughby c Pearl,Assume,6 LINDEN ROW FULTON H 20 WILLOUGHBY C PEARL,6,LINDEN ROW FULTON H 20 WILLOUGHBY C PEARL,,,,,,h in between,20,WILLOUGHBY,,,C PEARL,,,,,6,LINDEN,,,,W FULTON,,RO,
159 Myrtle h Cumberland n Myrtle,Assume,159 MYRTLE H CUMBERLAND N MYRTLE,159,MYRTLE H CUMBERLAND N MYRTLE,,,,,,h in between,,CUMBERLAND,,,N MYRTLE,,,,,,159,,,,,,MYRTLE,
NY h 22 Henry,Assume,NY H 22 HENRY,,,NY H 22 HENRY,,,,,h in between,22,HENRY,,,H,,,,,,,,,,NY,,,
105 Wall N Y h Fleet n Fulton av,Assume,105 WALL N Y H FLEET N FULTON AV,105,WALL N Y H FLEET N FULTON AV,,,,,,h in between,,FULTON,LEE,,FT N  AV,,,,,105,WALL,,,,,,N Y,
8 Cedar NY h 35 Sydney place,Assume,8 CEDAR NY H 35 SYDNEY PLACE,8,CEDAR NY H 35 SYDNEY PLACE,,,,,,h in between,,35,,,SYDNEY PLACE,,,,,8,CEDAR,,,,NY,,,
Bridge c High h 162 Bridge,Assume,BRIDGE C HIGH H 162 BRIDGE,,,BRIDGE C HIGH H 162 BRIDGE,,,,,h in between,162,RIDGE,,,B,,,,,,RIDGE,,,,,,B C HIGH,
186 Front N Y h 52 Pierrepont,Assume,186 FRONT N Y H 52 PIERREPONT,186,FRONT N Y H 52 PIERREPONT,,,,,,h in between,52,PIERREPONT,,,H,,,,,186,FRONT,,,,,,N Y,
N Y h 163 Washington,Assume,N Y H 163 WASHINGTON,,,N Y H 163 WASHINGTON,,,,,h in between,163,WASHINGTON,,,H,,,,,,,,,,,,N Y,
195 Washington h 36 Concord,Assume,195 WASHINGTON H 36 CONCORD,195,WASHINGTON H 36 CONCORD,,,,,,h in between,36,CONCORD,,,H,,,,,195,WASHINGTON,,,,,,,
128 Water N Y h 98 Clinton,Assume,128 WATER N Y H 98 CLINTON,128,WATER N Y H 98 CLINTON,,,,,,h in between,98,CLINTON,,,H,,,,,128,WATER,,,,,,N Y,
101 William N Y factory Pearl c Front h 138 Fulton,Assume,101 WILLIAM N Y FACTORY PEARL C FRONT H 138 FULTON,101,WILLIAM N Y FACTORY PEARL C FRONT H 138 FULTON,,,,,,h in between,138,FULTON,,,H,,,,,101,WILLIAM,,,,,,N Y FACTORY PEARL C FRONT,
101 William N Y h 47 Sands,Assume,101 WILLIAM N Y H 47 SANDS,101,WILLIAM N Y H 47 SANDS,,,,,,h in between,47,SANDS,,,H,,,,,101,WILLIAM,,,,,,N Y,
22 Pine N Y h 32 Willoughby,Assume,22 PINE N Y H 32 WILLOUGHBY,22,PINE N Y H 32 WILLOUGHBY,,,,,,h in between,32,WILLOUGHBY,,,H,,,,,22,PINE,,,,,,N Y,
N Y h 245 Bridge,Assume,N Y H 245 BRIDGE,,,N Y H 245 BRIDGE,,,,,h in between,245,RIDGE,,,B,,,,,,,,,,,,N Y,
N Y h 66 Court,Assume,N Y H 66 COURT,,,N Y H 66 COURT,,,,,h in between,,66,,,COURT,,,,,,,,,,,,N Y,
N Y h 22 Garden,Assume,N Y H 22 GARDEN,,,N Y H 22 GARDEN,,,,,h in between,22,GARDEN,,,H,,,,,,,,,,,,N Y,
N Y h 113 Henry,Assume,N Y H 113 HENRY,,,N Y H 113 HENRY,,,,,h in between,113,HENRY,,,H,,,,,,,,,,,,N Y,
29 Wall N Y h 70 Pierrepont,Assume,29 WALL N Y H 70 PIERREPONT,29,WALL N Y H 70 PIERREPONT,,,,,,h in between,70,PIERREPONT,,,H,,,,,29,WALL,,,,,,N Y,
merchant 83 JohnN Y h 3 YVillow,Assume,MERCHANT 83 JOHNN Y H 3 YVILLOW,83,JOHNN Y H 3 YVILLOW,,,,,,h in between,,3,,,YVILLOW,,,,,83,JOHN,,,,,,MERCHANT  N Y,
80 Cherry N Y h 56 Adams,Assume,80 CHERRY N Y H 56 ADAMS,80,CHERRY N Y H 56 ADAMS,,,,,,h in between,56,ADAMS,,,H,,,,,80,CHERRY,,,,,,N Y,
252 Pearl N Y' h 17 Myrtle av,Assume,252 PEARL N Y' H 17 MYRTLE AV,252,PEARL N Y' H 17 MYRTLE AV,,,,,,h in between,,17,,,MYRTLE AV,,,,,252,PEARL,,,,,,N Y',
Pearl c Plymouth h 22 Henry,Assume,PEARL C PLYMOUTH H 22 HENRY,,,PEARL C PLYMOUTH H 22 HENRY,,,,,h in between,22,HENRY,,,H,,,,,,PLYMOUTH,,,,,,PEARL C,
98 Pine N Y h 20 Sands,Assume,98 PINE N Y H 20 SANDS,98,PINE N Y H 20 SANDS,,,,,,h in between,20,SANDS,,,H,,,,,98,PINE,,,,,,N Y,
98 Pine N Y h 18 Sands,Assume,98 PINE N Y H 18 SANDS,98,PINE N Y H 18 SANDS,,,,,,h in between,18,SANDS,,,H,,,,,98,PINE,,,,,,N Y,
4 Front N Y h 21 Joralemon,Assume,4 FRONT N Y H 21 JORALEMON,4,FRONT N Y H 21 JORALEMON,,,,,,h in between,21,JORALEMON,,,H,,,,,4,FRONT,,,,,,N Y,
N Y h 75 Remsen n Henry,Assume,N Y H 75 REMSEN N HENRY,,,N Y H 75 REMSEN N HENRY,,,,,h in between,75,N HENRY,,,REMSEN,,,,,,,,,,,,N Y,
103 Maiden Lane N Y h 76 Adams,Assume,103 MAIDEN LANE N Y H 76 ADAMS,103,MAIDEN LANE N Y H 76 ADAMS,,,,,,h in between,76,ADAMS,,,H,,,,,103,MAIDEN LA,,,,,,NE N Y,
Flushing c Kent av h Franklin n Park av,Assume,FLUSHING C KENT AV H FRANKLIN N PARK AV,,,FLUSHING C KENT AV H FRANKLIN N PARK AV,,,,,h in between,,FRANKLIN,,,N PARK AV,,,,,,KENT,,,,FLUSHING,,C  AV,
"coal yard h lushing c , Kent av",Assume,"COAL YARD H LUSHING C , KENT AV",,,"COAL YARD H LUSHING C , KENT AV",,,,,h in between,,KENT,,,"LUSHING C ,  AV",,,,,,,,,,,,COAL YARD,
N Y h 50 State,Assume,N Y H 50 STATE,,,N Y H 50 STATE,,,,,h in between,50,STATE,,,H,,,,,,,,,,,,N Y,
1-13 Maiden Lane N Y h 42 Court,Assume,113 MAIDEN LANE N Y H 42 COURT,,,1-13 MAIDEN LANE N Y H 42 COURT,,,,,h in between,,42,,,COURT,,,,,113,MAIDEN LA,,,,,,NE N Y,
Water c Pearl h Clinton n Fulton av,Assume,WATER C PEARL H CLINTON N FULTON AV,,,WATER C PEARL H CLINTON N FULTON AV,,,,,h in between,,CLINTON,,FULTON,N  AV,,,,,,WATER,,,,,,C PEARL,
37 South William N Y h 35 Willow Place,Assume,37 SOUTH WILLIAM N Y H 35 WILLOW PLACE,37,SOUTH WILLIAM N Y H 35 WILLOW PLACE,,,,,,h in between,35,WILLOW PL,,,ACE,,,,,37,WILLIAM,,,,,,SOUTH  N Y,
Washington market N Y h 101 Jay,Assume,WASHINGTON MARKET N Y H 101 JAY,,,WASHINGTON MARKET N Y H 101 JAY,,,,,h in between,101,JAY,,,H,,,,,,WASHINGTON MARKET,,,,,,N Y,
83 Washington h Joralemon n Henry,Assume,83 WASHINGTON H JORALEMON N HENRY,83,WASHINGTON H JORALEMON N HENRY,,,,,,h in between,,JORALEMON,,,N HENRY,,,,,83,WASHINGTON,,,,,,,
73 William N Y h 43 Cranberry,Assume,73 WILLIAM N Y H 43 CRANBERRY,73,WILLIAM N Y H 43 CRANBERRY,,,,,,h in between,43,CRANBERRY,,,H,,,,,73,WILLIAM,,,,,,N Y,
15 Cortlandt N Y h 59 Hoyt,Assume,15 CORTLANDT N Y H 59 HOYT,15,CORTLANDT N Y H 59 HOYT,,,,,,h in between,59,HOYT,,,H,,,,,15,CORTLANDT,,,,,,N Y,
23 Myrtle av c Pearl h 34,Assume,23 MYRTLE AV C PEARL H 34,23,MYRTLE AV C PEARL H 34,,,,,,h in between,,34,,,H,,,,,23,PEARL,,,,,,MYRTLE AV C,
130 Broad N Y h 101 State,Assume,130 BROAD N Y H 101 STATE,130,BROAD N Y H 101 STATE,,,,,,h in between,101,STATE,,,H,,,,,130,BROAD,,,,,,N Y,
80 Wall N Y h 107 Concord,Assume,80 WALL N Y H 107 CONCORD,80,WALL N Y H 107 CONCORD,,,,,,h in between,107,CONCORD,,,H,,,,,80,WALL,,,,,,N Y,
90 Front N Y h 113 Livingston,Assume,90 FRONT N Y H 113 LIVINGSTON,90,FRONT N Y H 113 LIVINGSTON,,,,,,h in between,113,LIVINGSTON,,,H,,,,,90,FRONT,,,,,,N Y,
104 Wall N Y h 33 Cranberry,Assume,104 WALL N Y H 33 CRANBERRY,104,WALL N Y H 33 CRANBERRY,,,,,,h in between,33,CRANBERRY,,,H,,,,,104,WALL,,,,,,N Y,
137 Front N Y h 116 Johnson,Assume,137 FRONT N Y H 116 JOHNSON,137,FRONT N Y H 116 JOHNSON,,,,,,h in between,116,JOHNSON,,,H,,,,,137,FRONT,,,,,,N Y,
137 Front N Y h 307 Bridge,Assume,137 FRONT N Y H 307 BRIDGE,137,FRONT N Y H 307 BRIDGE,,,,,,h in between,307,RIDGE,,,B,,,,,137,FRONT,,,,,,N Y,
156 Broadway N Y h Clinton av c Myrtle av,Assume,156 BROADWAY N Y H CLINTON AV C MYRTLE AV,156,BROADWAY N Y H CLINTON AV C MYRTLE AV,,,,,,h in between,,CLINTON,,,AV C MYRTLE AV,,,,,156,BROADWAY,,,,,,N Y,
58 John N Y h Atlantic n Powers,Assume,58 JOHN N Y H ATLANTIC N POWERS,58,JOHN N Y H ATLANTIC N POWERS,,,,,,h in between,,ATLANTIC,,,N POWERS,,,,,58,JOHN,,,,,,N Y,
Plymouth Ch h 197 AYash-,Assume,PLYMOUTH CH H 197 AYASH,,,PLYMOUTH CH H 197 AYASH-,,,,,h in between,197,ASH,,,AY,,,,,,PLYMOUTH,,,,,,CH,
61 Liberty N Y h 73 Livingston ington,Assume,61 LIBERTY N Y H 73 LIVINGSTON INGTON,61,LIBERTY N Y H 73 LIVINGSTON INGTON,,,,,,h in between,73,LIVINGSTON,,,INGTON,,,,,61,LIBERTY,,,,,,N Y,
43 Fulton h 72 Sands,Assume,43 FULTON H 72 SANDS,43,FULTON H 72 SANDS,,,,,,h in between,72,SANDS,,,H,,,,,43,FULTON,,,,,,,
26 John N Y h 102 Nassau,Assume,26 JOHN N Y H 102 NASSAU,26,JOHN N Y H 102 NASSAU,,,,,,h in between,102,NASSAU,,,H,,,,,26,JOHN,,,,,,N Y,
stove manâr 45 Fulton h 103 YVilloughby,Assume,STOVE MANÂR 45 FULTON H 103 YVILLOUGHBY,,,STOVE MANâR 45 FULTON H 103 YVILLOUGHBY,,,,,h in between,,103,,,YVILLOUGHBY,,,,,,FULTON,,,,,,STOVE MANÂR 45,
"city surveyor and engineer , Montague place c Court h 305 Gold",Assume,"CITY SURVEYOR AND ENGINEER , MONTAGUE PLACE C COURT H 305 GOLD",,,"CITY SURVEYOR AND ENGINEER , MONTAGUE PLACE C COURT H 305 GOLD",,,,,h in between,305,GOLD,,,H,,,,,,MONTAGUE,,,,,,"CITY SURVEYOR AND ENGINEER ,  PLACE C COURT",
N Y h Clinton n Myrtle av,Assume,N Y H CLINTON N MYRTLE AV,,,N Y H CLINTON N MYRTLE AV,,,,,h in between,,CLINTON,,,N MYRTLE AV,,,,,,,,,,,,N Y,
Amity h 35 Douglass,Assume,AMITY H 35 DOUGLASS,,,AMITY H 35 DOUGLASS,,,,,h in between,35,DOUGLASS,,,H,,,,,,AMITY,,,,,,,
3d av c 27th st Gowanus h Williamsburgh,Assume,3D AV C 27TH ST GOWANUS H WILLIAMSBURGH,,,3D AV C 27TH ST GOWANUS H WILLIAMSBURGH,,,,,h in between,,,WILLIAMSBURG,,H,,,,,,AV C,,,,,,3D  27TH ST GOWANUS,
63 Atlantic h 61 Court,Assume,63 ATLANTIC H 61 COURT,63,ATLANTIC H 61 COURT,,,,,,h in between,,61,,,COURT,,,,,63,ATLANTIC,,,,,,,
63 Atlantic h Hicks b Sackett and Union,Assume,63 ATLANTIC H HICKS B SACKETT AND UNION,63,ATLANTIC H HICKS B SACKETT AND UNION,,,,,,h in between,,SACKETT,,UNION,HICKS B  AND,,,,,63,ATLANTIC,,,,,,,
N Y h 7 Middagh,Assume,N Y H 7 MIDDAGH,,,N Y H 7 MIDDAGH,,,,,h in between,7,MIDDAGH,,,H,,,,,,,,,,,,N Y,
31 Broad N Y h Cheeverpln Harririson,Assume,31 BROAD N Y H CHEEVERPLN HARRIRISON,31,BROAD N Y H CHEEVERPLN HARRIRISON,,,,,,h in between,,EVE,,,CHERPLN HARRIRISON,,,,,31,BROAD,,,,,,N Y,
Furman n State h Carlton n Park av,Assume,FURMAN N STATE H CARLTON N PARK AV,,,FURMAN N STATE H CARLTON N PARK AV,,,,,h in between,,PARK,,,CARLTON N  AV,,,,,,FURMAN,,,,,,N STATE,
222 Pearl N Y h 144 Jay,Assume,222 PEARL N Y H 144 JAY,222,PEARL N Y H 144 JAY,,,,,,h in between,144,JAY,,,H,,,,,222,PEARL,,,,,,N Y,
195 Washington h 182 Adams,Assume,195 WASHINGTON H 182 ADAMS,195,WASHINGTON H 182 ADAMS,,,,,,h in between,182,ADAMS,,,H,,,,,195,WASHINGTON,,,,,,,
102 Front h S3 Henry,Assume,102 FRONT H S3 HENRY,102,FRONT H S3 HENRY,,,,,,h in between,,HENRY,,,S3,,,,,102,FRONT,,,,,,,
Sl Water N Y h State n Bond,Assume,SL WATER N Y H STATE N BOND,,,SL WATER N Y H STATE N BOND,,,,,h in between,,STATE,,,N BOND,,,,,,WATER,,,,,,SL  N Y,
N Y h 147 Hicks,Assume,N Y H 147 HICKS,,,N Y H 147 HICKS,,,,,h in between,147,HICKS,,,H,,,,,,,,,,,,N Y,
141 Atlantic h 108 Pineapple,Assume,141 ATLANTIC H 108 PINEAPPLE,141,ATLANTIC H 108 PINEAPPLE,,,,,,h in between,108,PINEAPPLE,,,H,,,,,141,ATLANTIC,,,,,,,
merchantN Yh Montague place b Henry and Hicks Water h 37 Front,Assume,MERCHANTN YH MONTAGUE PLACE B HENRY AND HICKS WATER H 37 FRONT,,,MERCHANTN YH MONTAGUE PLACE B HENRY AND HICKS WATER H 37 FRONT,,,,,h in between,37,FRONT,,,H,,,,,,MONTAGUE,,,,,,MERCHANTN YH  PLACE B HENRY AND HICKS WATER,
11 Water h 85 Prospect,Assume,11 WATER H 85 PROSPECT,11,WATER H 85 PROSPECT,,,,,,h in between,85,PROSPECT,,,H,,,,,11,WATER,,,,,,,
26 Fulton h 15 Poplar,Assume,26 FULTON H 15 POPLAR,26,FULTON H 15 POPLAR,,,,,,h in between,15,POPLAR,,,H,,,,,26,FULTON,,,,,,,
37 Chauncy Court Wâall N Y h 32 Cottage row Columbia n Union,Assume,37 CHAUNCY COURT WÂALL N Y H 32 COTTAGE ROW COLUMBIA N UNION,37,CHAUNCY COURT WâALL N Y H 32 COTTAGE ROW COLUMBIA N UNION,,,,,,h in between,32,COLUMBIA,,UNION,COTTAGE ROW  N,,,,,,37,,,,,,CHAUNCY COURT WÂALL N Y,
160 William N Y h 56 Adams,Assume,160 WILLIAM N Y H 56 ADAMS,160,WILLIAM N Y H 56 ADAMS,,,,,,h in between,56,ADAMS,,,H,,,,,160,WILLIAM,,,,,,N Y,
Flushing e Kent av h Franklin b Park and Myrtle av,Assume,FLUSHING E KENT AV H FRANKLIN B PARK AND MYRTLE AV,,,FLUSHING E KENT AV H FRANKLIN B PARK AND MYRTLE AV,,,,,h in between,,FRANKLIN,,,B PARK AND MYRTLE AV,,,,,,KENT,,,,FLUSHING,,E  AV,
123 Atlantic h 1 Atlantic,Assume,123 ATLANTIC H 1 ATLANTIC,123,ATLANTIC H 1 ATLANTIC,,,,,,h in between,1,ATLANTIC,,,H,,,,,123,ATLANTIC,,,,,,,
274 Pearl N Y7 h 89 Pineapple,Assume,274 PEARL N Y7 H 89 PINEAPPLE,274,PEARL N Y7 H 89 PINEAPPLE,,,,,,h in between,89,PINEAPPLE,,,H,,,,,274,PEARL,,,,,,N Y7,
Columbia c Congress h 14 Sydney Place,Assume,COLUMBIA C CONGRESS H 14 SYDNEY PLACE,,,COLUMBIA C CONGRESS H 14 SYDNEY PLACE,,,,,h in between,,14,,,SYDNEY PLACE,,,,,,COLUMBIA,,,,,,C CONGRESS,
36 Ferry N Y h Flatbush turnpike n Powers,Assume,36 FERRY N Y H FLATBUSH TURNPIKE N POWERS,36,FERRY N Y H FLATBUSH TURNPIKE N POWERS,,,,,,h in between,,POWERS,FLATBUSH,,TURNPIKE N,,,,,36,FERRY,,,,,,N Y,
40 New N Y h 85 State,Assume,40 NEW N Y H 85 STATE,40,NEW N Y H 85 STATE,,,,,,h in between,85,STATE,,,H,,,,,40,NEW,,,,,,N Y,
N Y h 65 Hicks,Assume,N Y H 65 HICKS,,,N Y H 65 HICKS,,,,,h in between,65,HICKS,,,H,,,,,,,,,,,,N Y,
N Y h 96 Hicks,Assume,N Y H 96 HICKS,,,N Y H 96 HICKS,,,,,h in between,96,HICKS,,,H,,,,,,,,,,,,N Y,
199 Fulton h 96 Hicks,Assume,199 FULTON H 96 HICKS,199,FULTON H 96 HICKS,,,,,,h in between,96,HICKS,,,H,,,,,199,FULTON,,,,,,,
N Y h 119 Columbia n Clark,Assume,N Y H 119 COLUMBIA N CLARK,,,N Y H 119 COLUMBIA N CLARK,,,,,h in between,119,COLUMBIA,,,N CLARK,,,,,,,,,,,,N Y,
grocery and wood dealer junc of Atlantic and Fulton h State n Powers,Assume,GROCERY AND WOOD DEALER JUNC OF ATLANTIC AND FULTON H STATE N POWERS,,,GROCERY AND WOOD DEALER JUNC OF ATLANTIC AND FULTON H STATE N POWERS,,,,,h in between,,POWERS,,,STATE N,,,,,,ATLANTIC,,,,DEAL,FULTON,GROCERY AND WOOD ER JUNC OF  AND,
232 Fulton h 79 Poplar,Assume,232 FULTON H 79 POPLAR,232,FULTON H 79 POPLAR,,,,,,h in between,79,POPLAR,,,H,,,,,232,FULTON,,,,,,,
Union coffee and spice mills Jay c Chapel h 145 Nassau Prince,Assume,UNION COFFEE AND SPICE MILLS JAY C CHAPEL H 145 NASSAU PRINCE,,,UNION COFFEE AND SPICE MILLS JAY C CHAPEL H 145 NASSAU PRINCE,,,,,h in between,145,PRINCE,,NASSAU,H,,,,,,CHAPEL,,,,,UNION,COFFEE AND SPICE MILLS JAY C,
Watcr n Fulton h 110,Assume,WATCR N FULTON H 110,,,WATCR N FULTON H 110,,,,,h in between,,110,,,H,,,,,,FULTON,,,,,,WATCR N,
Union foundry & machine shop Water n Fulton ferry h Smith n Schermerhorn,Assume,UNION FOUNDRY & MACHINE SHOP WATER N FULTON FERRY H SMITH N SCHERMERHORN,,,UNION FOUNDRY & MACHINE SHOP WATER N FULTON FERRY H SMITH N SCHERMERHORN,,,,,h in between,,SCHERMERHORN,,,SMITN,,,,,,FULTON,,,,,UNION,FOUNDRY & MACHINE SHOP WATER N  FERRY,
"Birney Charles FI , Sec. East River Ins Co 61 W'all st N Y h Clinton n Myrtle av",Assume,"BIRNEY CHARLES FI , SEC. EAST RIVER INS CO 61 W'ALL ST N Y H CLINTON N MYRTLE AV",,,"BIRNEY CHARLES FI , SEC. EAST RIVER INS CO 61 W'ALL ST N Y H CLINTON N MYRTLE AV",,,,,h in between,,CLINTON,,,N MYRTLE AV,,,,,,,CHARLES,RIVER,corner,,,"BIRNEY  FI , SEC. EAST  INS CO 61 W'ALL ST N Y",
market-man cor Sands & Pearl h 101 Pearl,Assume,MARKETMAN COR SANDS & PEARL H 101 PEARL,,,MARKET-MAN COR SANDS & PEARL H 101 PEARL,,,,,h in between,101,PEARL,,,H,,,,,,MARKET,,,,,,MAN COR SANDS & PEARL,
Phoenix Bank N Y h 175 Adams,Assume,PHOENIX BANK N Y H 175 ADAMS,,,PHOENIX BANK N Y H 175 ADAMS,,,,,h in between,175,ADAMS,,,H,,,,,,BANK,,,,PHOENIX,,N Y,
Doughty st h 25 Fulton,Assume,DOUGHTY ST H 25 FULTON,,,DOUGHTY ST H 25 FULTON,,,,,h in between,25,FULTON,,,H,,,,,,DOUGHTY,,,,,,ST,
42 Fulton N Y h 134 Adams,Assume,42 FULTON N Y H 134 ADAMS,42,FULTON N Y H 134 ADAMS,,,,,,h in between,134,ADAMS,,,H,,,,,42,FULTON,,,,,,N Y,
179 Broadway NY h 75 Pineapple,Assume,179 BROADWAY NY H 75 PINEAPPLE,179,BROADWAY NY H 75 PINEAPPLE,,,,,,h in between,75,PINEAPPLE,,,H,,,,,179,BROADWAY,,,,NY,,,
100 William N Y h 86 Clinton,Assume,100 WILLIAM N Y H 86 CLINTON,100,WILLIAM N Y H 86 CLINTON,,,,,,h in between,86,CLINTON,,,H,,,,,100,WILLIAM,,,,,,N Y,
Atlantic c Columbia and Columbia n Union h 6 Blakeâs Buildings Court st,Assume,ATLANTIC C COLUMBIA AND COLUMBIA N UNION H 6 BLAKEÂS BUILDINGS COURT ST,,,ATLANTIC C COLUMBIA AND COLUMBIA N UNION H 6 BLAKEâS BUILDINGS COURT ST,,,,,h in between,6,LAKE,,,BÂS BUILDINGS COURT ST,,,,,,COLUMBIA,,,,,ATLANTIC,C  AND  N UNION,
12 Broadway N Y h 143 Court n Warren,Assume,12 BROADWAY N Y H 143 COURT N WARREN,12,BROADWAY N Y H 143 COURT N WARREN,,,,,,h in between,143,WARREN,,,COURT N,,,,,12,BROADWAY,,,,,,N Y,
11 'Wall N Y h Washington an,Assume,11 'WALL N Y H WASHINGTON AN,11,'WALL N Y H WASHINGTON AN,,,,,,h in between,,WASHINGTON,,,AN,,,,,11,WALL,,,,,,' N Y,
4 Cortlandt N Y h 139 Sands,Assume,4 CORTLANDT N Y H 139 SANDS,4,CORTLANDT N Y H 139 SANDS,,,,,,h in between,139,SANDS,,,H,,,,,4,CORTLANDT,,,,,,N Y,
67 William N Y h 267 Jay,Assume,67 WILLIAM N Y H 267 JAY,67,WILLIAM N Y H 267 JAY,,,,,,h in between,267,JAY,,,H,,,,,67,WILLIAM,,,,,,N Y,
52 Cedar N Y h 90 Harrison,Assume,52 CEDAR N Y H 90 HARRISON,52,CEDAR N Y H 90 HARRISON,,,,,,h in between,,90,HARRIS,,ON,,,,,52,CEDAR,,,,,,N Y,
136 Nassau N Y h Myrtle n Clinton av,Assume,136 NASSAU N Y H MYRTLE N CLINTON AV,136,NASSAU N Y H MYRTLE N CLINTON AV,,,,,,h in between,,CLINTON,,,MYRTLE N  AV,,,,,136,NASSAU,,,,,,N Y,
42 Fulton N Y h 90 Columbia,Assume,42 FULTON N Y H 90 COLUMBIA,42,FULTON N Y H 90 COLUMBIA,,,,,,h in between,90,COLUMBIA,,,H,,,,,42,FULTON,,,,,,N Y,
