Front b Bridge and Gold h Duffield b Willoughby st and Myrtle av,Assume,FRONT B BRIDGE AND GOLD H DUFFIELD B WILLOUGHBY ST AND MYRTLE AV,,,FRONT B BRIDGE AND GOLD H DUFFIELD B WILLOUGHBY ST AND MYRTLE AV,,,,,h in between,,WILLOUGHBY,,,DUFFIELD B  ST AND MYRTLE AV,,,,,,RIDGE,,,,,,FRONT B B AND GOLD,
NY h 89 Henry,Assume,NY H 89 HENRY,,,NY H 89 HENRY,,,,,h in between,89,HENRY,,,H,,,,,,,,,,NY,,,
130 Atlantic e Henry h 92 Har-,Assume,130 ATLANTIC E HENRY H 92 HAR,130,ATLANTIC E HENRY H 92 HAR-,,,,,,h in between,,92,,,HAR,,,,,130,ATLANTIC,,,,,,E HENRY,
N Y h 73 Hicks c Orange,Assume,N Y H 73 HICKS C ORANGE,,,N Y H 73 HICKS C ORANGE,,,,,h in between,73,ORANGE,,,HICKS C,,,,,,,,,,,,N Y,
N Y h 49 Johnson,Assume,N Y H 49 JOHNSON,,,N Y H 49 JOHNSON,,,,,h in between,49,JOHNSON,,,H,,,,,,,,,,,,N Y,
9 Myrtle h 195 Pearl,Assume,9 MYRTLE H 195 PEARL,9,MYRTLE H 195 PEARL,,,,,,h in between,195,PEARL,,,H,,,,,,9,,,,,,MYRTLE,
70 Lispenard N Y h 72 Hicks,Assume,70 LISPENARD N Y H 72 HICKS,70,LISPENARD N Y H 72 HICKS,,,,,,h in between,72,HICKS,,,H,,,,,70,LISPENARD,,,,,,N Y,
Doughty st h 145 Jay,Assume,DOUGHTY ST H 145 JAY,,,DOUGHTY ST H 145 JAY,,,,,h in between,145,JAY,,,H,,,,,,DOUGHTY,,,,,,ST,
27 Nassau N Y h 221 Jay,Assume,27 NASSAU N Y H 221 JAY,27,NASSAU N Y H 221 JAY,,,,,,h in between,221,JAY,,,H,,,,,27,NASSAU,,,,,,N Y,
N Y Bank h 54 Hicks,Assume,N Y BANK H 54 HICKS,,,N Y BANK H 54 HICKS,,,,,h in between,54,HICKS,,,H,,,,,,BANK,,,,,,N Y,
James n Market h 137 Sands,Assume,JAMES N MARKET H 137 SANDS,,,JAMES N MARKET H 137 SANDS,,,,,h in between,137,SANDS,,,H,,,,,,MARKET,,,,,,JAMES N,
N Y h IS Douglass,Assume,N Y H IS DOUGLASS,,,N Y H IS DOUGLASS,,,,,h in between,,DOUGLASS,,,IS,,,,,,,,,,,,N Y,
boots & shoes 36 Broadway N Y h 55 Baltic,Assume,BOOTS & SHOES 36 BROADWAY N Y H 55 BALTIC,,,BOOTS & SHOES 36 BROADWAY N Y H 55 BALTIC,,,,,h in between,55,BALTIC,,,H,,,,,,BROADWAY,,,,,,BOOTS & SHOES 36  N Y,
31 Broad N Y h 30 Garden,Assume,31 BROAD N Y H 30 GARDEN,31,BROAD N Y H 30 GARDEN,,,,,,h in between,30,GARDEN,,,H,,,,,31,BROAD,,,,,,N Y,
107 Broad N Y h Clin-,Assume,107 BROAD N Y H CLIN,107,BROAD N Y H CLIN-,,,,,,h in between,,,,,CLIN,,,,,107,BROAD,,,,,,N Y,
29 Cedar N Y h 62 Prince,Assume,29 CEDAR N Y H 62 PRINCE,29,CEDAR N Y H 62 PRINCE,,,,,,h in between,62,PRINCE,,,H,,,,,29,CEDAR,,,,,,N Y,
Columbia c President h President n Columbia,Assume,COLUMBIA C PRESIDENT H PRESIDENT N COLUMBIA,,,COLUMBIA C PRESIDENT H PRESIDENT N COLUMBIA,,,,,h in between,,PRESIDENT,,COLUMBIA,N,,,,,,PRESIDENT,,,,,COLUMBIA,C,
Columbia c President h President n Columbia,Assume,COLUMBIA C PRESIDENT H PRESIDENT N COLUMBIA,,,COLUMBIA C PRESIDENT H PRESIDENT N COLUMBIA,,,,,h in between,,PRESIDENT,,COLUMBIA,N,,,,,,PRESIDENT,,,,,COLUMBIA,C,
3 Pine N Y h Cheevcr place n Harrison,Assume,3 PINE N Y H CHEEVCR PLACE N HARRISON,3,PINE N Y H CHEEVCR PLACE N HARRISON,,,,,,h in between,,,HARRIS,,CHEEVCR PLACE N ON,,,,,3,PINE,,,,,,N Y,
N Y h 122 York,Assume,N Y H 122 YORK,,,N Y H 122 YORK,,,,,h in between,122,YORK,,,H,,,,,,,,,,,,N Y,
Brooklyn Independent c Orange and Fulton st h Sth av b 13th and 14th sts,Assume,BROOKLYN INDEPENDENT C ORANGE AND FULTON ST H STH AV B 13TH AND 14TH STS,,,BROOKLYN INDEPENDENT C ORANGE AND FULTON ST H STH AV B 13TH AND 14TH STS,,,,,h in between,,AV B,,,ST 13TAND 14TSTS,,,,,,FULTON,,,,BROOKLYN,ORANGE,INDEPENDENT C  AND  ST,
45 Fulton h 60 Hicks,Assume,45 FULTON H 60 HICKS,45,FULTON H 60 HICKS,,,,,,h in between,60,HICKS,,,H,,,,,45,FULTON,,,,,,,
IS Maiden lane NY h 25 Prospect,Assume,IS MAIDEN LANE NY H 25 PROSPECT,,,IS MAIDEN LANE NY H 25 PROSPECT,,,,,h in between,25,PROSPECT,,,H,,,,,,MAIDEN LA,,,,NY,,IS NE,
Johnson c Lawrence h 109 Tillary,Assume,JOHNSON C LAWRENCE H 109 TILLARY,,,JOHNSON C LAWRENCE H 109 TILLARY,,,,,h in between,109,TILLARY,,,H,,,,,,LAWRENCE,,,,,,JOHNSON C,
295 Pearl N Y h 107 Pearl,Assume,295 PEARL N Y H 107 PEARL,295,PEARL N Y H 107 PEARL,,,,,,h in between,107,PEARL,,,H,,,,,295,PEARL,,,,,,N Y,
97 Maiden Lane NY h 35 Pineapple,Assume,97 MAIDEN LANE NY H 35 PINEAPPLE,97,MAIDEN LANE NY H 35 PINEAPPLE,,,,,,h in between,35,PINEAPPLE,,,H,,,,,97,MAIDEN LA,,,,NY,,NE,
N Y h 35 Pineapple,Assume,N Y H 35 PINEAPPLE,,,N Y H 35 PINEAPPLE,,,,,h in between,35,PINEAPPLE,,,H,,,,,,,,,,,,N Y,
236 Front NY h 4 Clark,Assume,236 FRONT NY H 4 CLARK,236,FRONT NY H 4 CLARK,,,,,,h in between,4,CLARK,,,H,,,,,236,FRONT,,,,NY,,,
55 Cedar N Y h Court c Union,Assume,55 CEDAR N Y H COURT C UNION,55,CEDAR N Y H COURT C UNION,,,,,,h in between,,UNION,,,COURT C,,,,,55,CEDAR,,,,,,N Y,
124 Broadway NY h 102 Columbia,Assume,124 BROADWAY NY H 102 COLUMBIA,124,BROADWAY NY H 102 COLUMBIA,,,,,,h in between,102,COLUMBIA,,,H,,,,,124,BROADWAY,,,,NY,,,
John & William NY h 46 State BROOKLYN B I R .E C T O B Y.,Assume,JOHN & WILLIAM NY H 46 STATE BROOKLYN B I R .E C T O B Y.,,,JOHN & WILLIAM NY H 46 STATE BROOKLYN B I R .E C T O B Y.,,,,,h in between,46,STATE,BROOKLYN,,B I R .E C T O B Y.,,,,,,WILLIAM,,,,NY,,JOHN &,
NY h 129 Duffield,Assume,NY H 129 DUFFIELD,,,NY H 129 DUFFIELD,,,,,h in between,129,DUFFIELD,,,H,,,,,,,,,,NY,,,
Columbia c Pacific h 95 State,Assume,COLUMBIA C PACIFIC H 95 STATE,,,COLUMBIA C PACIFIC H 95 STATE,,,,,h in between,95,STATE,,,H,,,,,,COLUMBIA,,,,,,C PACIFIC,
37 Pine NY h 29 Pierrepont,Assume,37 PINE NY H 29 PIERREPONT,37,PINE NY H 29 PIERREPONT,,,,,,h in between,29,PIERREPONT,,,H,,,,,37,PINE,,,,NY,,,
29 South NY h Schermerhorn. n Hoyt,Assume,29 SOUTH NY H SCHERMERHORN. N HOYT,29,SOUTH NY H SCHERMERHORN. N HOYT,,,,,,h in between,,SCHERMERHORN,,,. N HOYT,,,,,,29,,,,NY,,SOUTH,
32 Soulh NY h 7 Butler,Assume,32 SOULH NY H 7 BUTLER,32,SOULH NY H 7 BUTLER,,,,,,h in between,7,BUTLER,,,H,,,,,,32,,,,NY,,SOULH,
5 Wall NYr h 109 Clinton,Assume,5 WALL NYR H 109 CLINTON,5,WALL NYR H 109 CLINTON,,,,,,h in between,109,CLINTON,,,H,,,,,5,WALL,,,,NY,,R,
104 John NY h 62. Livingston,Assume,104 JOHN NY H 62. LIVINGSTON,104,JOHN NY H 62. LIVINGSTON,,,,,,h in between,,LIVINGSTON,,,62,,,,,104,JOHN,,,,NY,,,
29 James h Schermerhorn n Bond,Assume,29 JAMES H SCHERMERHORN N BOND,29,JAMES H SCHERMERHORN N BOND,,,,,,h in between,,SCHERMERHORN,,,N BOND,,,,,29,JAMES,,,,,,,
NY h Atlantic n Powers,Assume,NY H ATLANTIC N POWERS,,,NY H ATLANTIC N POWERS,,,,,h in between,,ATLANTIC,,,N POWERS,,,,,,,,,,NY,,,
"block and pump maker foot of , Main & 23 Washington h 43 Front",Assume,"BLOCK AND PUMP MAKER FOOT OF , MAIN & 23 WASHINGTON H 43 FRONT",,,"BLOCK AND PUMP MAKER FOOT OF , MAIN & 23 WASHINGTON H 43 FRONT",,,,,h in between,43,FRONT,,,H,,,,,,WASHINGTON,,,,,,"BLOCK AND PUMP MAKER FOOT OF , MAIN & 23",
Atlantic c Furman h 31 Baltic n Smith,Assume,ATLANTIC C FURMAN H 31 BALTIC N SMITH,,,ATLANTIC C FURMAN H 31 BALTIC N SMITH,,,,,h in between,31,BALTIC,,,N SMITH,,,,,,ATLANTIC,,,,,,C FURMAN,
N Y h 113 Nassau,Assume,N Y H 113 NASSAU,,,N Y H 113 NASSAU,,,,,h in between,113,NASSAU,,,H,,,,,,,,,,,,N Y,
N Y h 45 Dean,Assume,N Y H 45 DEAN,,,N Y H 45 DEAN,,,,,h in between,45,DEAN,,,H,,,,,,,,,,,,N Y,
altây & counslâr 299 Fulton h 35 Prince,Assume,ALTÂY & COUNSLÂR 299 FULTON H 35 PRINCE,,,ALTâY & COUNSLâR 299 FULTON H 35 PRINCE,,,,,h in between,35,PRINCE,,,H,,,,,,FULTON,,,,,,ALTÂY & COUNSLÂR 299,
1st teller merchantâs bank N Y h 73 Remsen,Assume,1ST TELLER MERCHANTÂS BANK N Y H 73 REMSEN,,,1ST TELLER MERCHANTâS BANK N Y H 73 REMSEN,,,,,h in between,73,REMSEN,,,H,,,,,,BANK,,,,,,1ST TELLER MERCHANTÂS  N Y,
51 Wall st N Y h 73 Remsen,Assume,51 WALL ST N Y H 73 REMSEN,51,WALL ST N Y H 73 REMSEN,,,,,,h in between,73,REMSEN,,,H,,,,,51,WALL,,,,,,ST N Y,
Court st op City Hall h 73 Remsen,Assume,COURT ST OP CITY HALL H 73 REMSEN,,,COURT ST OP CITY HALL H 73 REMSEN,,,,,h in between,73,REMSEN,,,H,,,,,,HALL,,,,,,COURT ST OP CITY,
"grocery and feed store , Gold c York h 218 Front",Assume,"GROCERY AND FEED STORE , GOLD C YORK H 218 FRONT",,,"GROCERY AND FEED STORE , GOLD C YORK H 218 FRONT",,,,,h in between,218,FRONT,,,H,,,,,,YORK,,,,,,"GROCERY AND FEED STORE , GOLD C",
10 Ferry N Y h 66 High,Assume,10 FERRY N Y H 66 HIGH,10,FERRY N Y H 66 HIGH,,,,,,h in between,66,HIGH,,,H,,,,,10,FERRY,,,,,,N Y,
Fulton market N Y and Fulton c Hudson av h 350 Fulton,Assume,FULTON MARKET N Y AND FULTON C HUDSON AV H 350 FULTON,,,FULTON MARKET N Y AND FULTON C HUDSON AV H 350 FULTON,,,,,h in between,350,FULTON,,,H,,,,,,FULTON MARKET,,,,,FULTON,N Y AND  C HUDSON AV,
4 Linden row Fulton h 281 Jay,Assume,4 LINDEN ROW FULTON H 281 JAY,4,LINDEN ROW FULTON H 281 JAY,,,,,,h in between,281,JAY,,,H,,,,,4,LINDEN,,,,W FULTON,,RO,
57 William N Y h 107 Willoughby,Assume,57 WILLIAM N Y H 107 WILLOUGHBY,57,WILLIAM N Y H 107 WILLOUGHBY,,,,,,h in between,107,WILLOUGHBY,,,H,,,,,57,WILLIAM,,,,,,N Y,
34 Fulton h 27 Hicks,Assume,34 FULTON H 27 HICKS,34,FULTON H 27 HICKS,,,,,,h in between,27,HICKS,,,H,,,,,34,FULTON,,,,,,,
79 Maiden lane N Y h 8 Remsen,Assume,79 MAIDEN LANE N Y H 8 REMSEN,79,MAIDEN LANE N Y H 8 REMSEN,,,,,,h in between,8,REMSEN,,,H,,,,,79,MAIDEN LA,,,,,,NE N Y,
30 Broad N Y h 40 Remsen,Assume,30 BROAD N Y H 40 REMSEN,30,BROAD N Y H 40 REMSEN,,,,,,h in between,40,REMSEN,,,H,,,,,30,BROAD,,,,,,N Y,
Custom house N Y h 39 Sydney place,Assume,CUSTOM HOUSE N Y H 39 SYDNEY PLACE,,,CUSTOM HOUSE N Y H 39 SYDNEY PLACE,,,,,h in between,,39,,,SYDNEY PLACE,,,,,,,,,,,,CUSTOM HOUSE N Y,
mer. N Y h 84 Henry,Assume,MER. N Y H 84 HENRY,,,MER. N Y H 84 HENRY,,,,,h in between,84,HENRY,,,H,,,,,,,,,,,,MER. N Y,
Fulton bank NY h Franklin n Myrtle av,Assume,FULTON BANK NY H FRANKLIN N MYRTLE AV,,,FULTON BANK NY H FRANKLIN N MYRTLE AV,,,,,h in between,,FRANKLIN,,,N MYRTLE AV,,,,,,FULTON,,,,NY,,BANK,
206 Nassau h 178,Assume,206 NASSAU H 178,206,NASSAU H 178,,,,,,h in between,,178,,,H,,,,,206,NASSAU,,,,,,,
57 Fulton h 55 Pierrepont,Assume,57 FULTON H 55 PIERREPONT,57,FULTON H 55 PIERREPONT,,,,,,h in between,55,PIERREPONT,,,H,,,,,57,FULTON,,,,,,,
101 Middagh h 95,Assume,101 MIDDAGH H 95,101,MIDDAGH H 95,,,,,,h in between,,95,,,H,,,,,101,MIDDAGH,,,,,,,
mer. N Y h 77 Willoughby,Assume,MER. N Y H 77 WILLOUGHBY,,,MER. N Y H 77 WILLOUGHBY,,,,,h in between,77,WILLOUGHBY,,,H,,,,,,,,,,,,MER. N Y,
206 Nassau h 17S Nassau,Assume,206 NASSAU H 17S NASSAU,206,NASSAU H 17S NASSAU,,,,,,h in between,,NASSAU,,,17S,,,,,206,NASSAU,,,,,,,
25 Maiden lane N Y h 35 Sands,Assume,25 MAIDEN LANE N Y H 35 SANDS,25,MAIDEN LANE N Y H 35 SANDS,,,,,,h in between,35,SANDS,,,H,,,,,25,MAIDEN LA,,,,,,NE N Y,
105 John N Y h 16 Hicks,Assume,105 JOHN N Y H 16 HICKS,105,JOHN N Y H 16 HICKS,,,,,,h in between,16,HICKS,,,H,,,,,105,JOHN,,,,,,N Y,
108 Concord h 23 Chapel,Assume,108 CONCORD H 23 CHAPEL,108,CONCORD H 23 CHAPEL,,,,,,h in between,23,CHAPEL,,,H,,,,,108,CONCORD,,,,,,,
50 Maiden lane NY7 h 55 Sands,Assume,50 MAIDEN LANE NY7 H 55 SANDS,50,MAIDEN LANE NY7 H 55 SANDS,,,,,,h in between,55,SANDS,,,H,,,,,50,MAIDEN LA,,,,NY,,NE 7,
President st h Division av n Quincyst,Assume,PRESIDENT ST H DIVISION AV N QUINCYST,,,PRESIDENT ST H DIVISION AV N QUINCYST,,,,,h in between,,DIVISION,,,AV N QUINCYST,,,,,,PRESIDENT,,,,,,ST,
13 Princen Johnson surrogate office city hall) h 79 Hicks,Assume,13 PRINCEN JOHNSON SURROGATE OFFICE CITY HALL) H 79 HICKS,13,PRINCEN JOHNSON SURROGATE OFFICE CITY HALL) H 79 HICKS,,,,,,h in between,79,HICKS,,,H,,,,,13,JOHNSON,,,,,,PRINCEN  SURROGATE OFFICE CITY HALL),
11 Stone N Y h 21 Concord,Assume,11 STONE N Y H 21 CONCORD,11,STONE N Y H 21 CONCORD,,,,,,h in between,21,CONCORD,,,H,,,,,11,STONE,,,,,,N Y,
counsellor and attorney City Hall 229 Fulton h 71 Johnson justices court],Assume,COUNSELLOR AND ATTORNEY CITY HALL 229 FULTON H 71 JOHNSON JUSTICES COURT],,,COUNSELLOR AND ATTORNEY CITY HALL 229 FULTON H 71 JOHNSON JUSTICES COURT],,,,,h in between,71,JOHNSON,,,JUSTICES COURT],,,,,,ATTORNEY,,,,,FULTON,COUNSELLOR AND  CITY HALL 229,
216 William N Yâ h 54 Lawtence n Willoughby,Assume,216 WILLIAM N YÂ H 54 LAWTENCE N WILLOUGHBY,216,WILLIAM N Yâ H 54 LAWTENCE N WILLOUGHBY,,,,,,h in between,54,WILLOUGHBY,,,LAWTENCE N,,,,,216,WILLIAM,,,,,,N YÂ,
63 Front N Y h 137 Duffield,Assume,63 FRONT N Y H 137 DUFFIELD,63,FRONT N Y H 137 DUFFIELD,,,,,,h in between,137,DUFFIELD,,,H,,,,,63,FRONT,,,,,,N Y,
86 Fulton h 9S Prospect,Assume,86 FULTON H 9S PROSPECT,86,FULTON H 9S PROSPECT,,,,,,h in between,,PROSPECT,,,9S,,,,,86,FULTON,,,,,,,
"294 Pearl N Y h Ca,rlton b Myrtle and DeKalb av",Assume,"294 PEARL N Y H CA,RLTON B MYRTLE AND DEKALB AV",294,"PEARL N Y H CA,RLTON B MYRTLE AND DEKALB AV",,,,,,h in between,,,,,"CA,RLTON B MYRTLE AND DEKALB AV",,,,,294,PEARL,,,,,,N Y,
50 Maiden Lane N Y h 53 Sands,Assume,50 MAIDEN LANE N Y H 53 SANDS,50,MAIDEN LANE N Y H 53 SANDS,,,,,,h in between,53,SANDS,,,H,,,,,50,MAIDEN LA,,,,,,NE N Y,
202 Fulton h Globe hotel,Assume,202 FULTON H GLOBE HOTEL,202,FULTON H GLOBE HOTEL,,,,,,h in between,,,,,GLOBE HOTEL,,,,,202,FULTON,,,,,,,
Sackett n Columbia h 1 Henry,Assume,SACKETT N COLUMBIA H 1 HENRY,,,SACKETT N COLUMBIA H 1 HENRY,,,,,h in between,1,HENRY,,,H,,,,,,COLUMBIA,,,,,,SACKETT N,
N Y h 171 Clinton,Assume,N Y H 171 CLINTON,,,N Y H 171 CLINTON,,,,,h in between,171,CLINTON,,,H,,,,,,,,,,,,N Y,
L I bank h Bridge n Willoughby,Assume,L I BANK H BRIDGE N WILLOUGHBY,,,L I BANK H BRIDGE N WILLOUGHBY,,,,,h in between,,WILLOUGHBY,,,BRIDGE N,,,,,,BANK,,,,L I,,,
104 Pearl N Y h 40 Joralemon,Assume,104 PEARL N Y H 40 JORALEMON,104,PEARL N Y H 40 JORALEMON,,,,,,h in between,40,JORALEMON,,,H,,,,,104,PEARL,,,,,,N Y,
Fulton market N Y h 24 Carlton av,Assume,FULTON MARKET N Y H 24 CARLTON AV,,,FULTON MARKET N Y H 24 CARLTON AV,,,,,h in between,,24,,,CARLTON AV,,,,,,FULTON MARKET,,,,,,N Y,
206 Nassau h 178,Assume,206 NASSAU H 178,206,NASSAU H 178,,,,,,h in between,,178,,,H,,,,,206,NASSAU,,,,,,,
91 Wall N Y h State n Nevins,Assume,91 WALL N Y H STATE N NEVINS,91,WALL N Y H STATE N NEVINS,,,,,,h in between,,NEVINS,,,STATE N,,,,,91,WALL,,,,,,N Y,
Howard house 40 Main c Water and livery stable 76 Water h 78 Nassau,Assume,HOWARD HOUSE 40 MAIN C WATER AND LIVERY STABLE 76 WATER H 78 NASSAU,,,HOWARD HOUSE 40 MAIN C WATER AND LIVERY STABLE 76 WATER H 78 NASSAU,,,,,h in between,78,NASSAU,,,H,,,,,,HOWARD,,,,,,HOUSE 40 MAIN C WATER AND LIVERY STABLE 76 WATER,
165 Fulton h 271 Pearl,Assume,165 FULTON H 271 PEARL,165,FULTON H 271 PEARL,,,,,,h in between,271,PEARL,,,H,,,,,165,FULTON,,,,,,,
149 Myrtle av h 244 Hud-,Assume,149 MYRTLE AV H 244 HUD,149,MYRTLE AV H 244 HUD-,,,,,,h in between,,244,,,HUD,,,,,,149,,,,,,MYRTLE AV,
9 Montague Hall Court st h 6 Douglass,Assume,9 MONTAGUE HALL COURT ST H 6 DOUGLASS,9,MONTAGUE HALL COURT ST H 6 DOUGLASS,,,,,,h in between,6,DOUGLASS,,,H,,,,,9,MONTAGUE,,,,,,HALL COURT ST,
123 William N Y h 53 Remsen,Assume,123 WILLIAM N Y H 53 REMSEN,123,WILLIAM N Y H 53 REMSEN,,,,,,h in between,53,REMSEN,,,H,,,,,123,WILLIAM,,,,,,N Y,
247 Pearl N Y h 47 Johnson,Assume,247 PEARL N Y H 47 JOHNSON,247,PEARL N Y H 47 JOHNSON,,,,,,h in between,47,JOHNSON,,,H,,,,,247,PEARL,,,,,,N Y,
18 Fulton N Y h 74 Adams,Assume,18 FULTON N Y H 74 ADAMS,18,FULTON N Y H 74 ADAMS,,,,,,h in between,74,ADAMS,,,H,,,,,18,FULTON,,,,,,N Y,
31 Fulton h Hanover place n Fulton av,Assume,31 FULTON H HANOVER PLACE N FULTON AV,31,FULTON H HANOVER PLACE N FULTON AV,,,,,,h in between,,HANOVER PL,,FULTON,ACE N  AV,,,,,31,FULTON,,,,,,,
merchant 5 Coentieâs slip NY h Atlantic Union b Columbia and Canton Livingston,Assume,MERCHANT 5 COENTIEÂS SLIP NY H ATLANTIC UNION B COLUMBIA AND CANTON LIVINGSTON,5,COENTIEâS SLIP NY H ATLANTIC UNION B COLUMBIA AND CANTON LIVINGSTON,,,,,,h in between,,LIVINGSTON,CANTON,ATLANTIC,UNION B COLUMBIA AND,,,,,,5,,,,NY,,MERCHANT  COENTIEÂS SLIP,
114 Broad N Y h 56,Assume,114 BROAD N Y H 56,114,BROAD N Y H 56,,,,,,h in between,,56,,,H,,,,,114,BROAD,,,,,,N Y,
agent office 10 Bridge NY h 165 Atlantic,Assume,AGENT OFFICE 10 BRIDGE NY H 165 ATLANTIC,,,AGENT OFFICE 10 BRIDGE NY H 165 ATLANTIC,,,,,h in between,165,ATLANTIC,,,H,,,,,,RIDGE,,,,NY,,AGENT OFFICE 10 B,
N Y h 19 Front,Assume,N Y H 19 FRONT,,,N Y H 19 FRONT,,,,,h in between,19,FRONT,,,H,,,,,,,,,,,,N Y,
N Y h 90 Willow,Assume,N Y H 90 WILLOW,,,N Y H 90 WILLOW,,,,,h in between,90,WILLOW,,,H,,,,,,,,,,,,N Y,
South Brooklyn Presbyterian ch h 3 Warren,Assume,SOUTH BROOKLYN PRESBYTERIAN CH H 3 WARREN,,,SOUTH BROOKLYN PRESBYTERIAN CH H 3 WARREN,,,,,h in between,3,WARREN,,,H,,,,,,,,,,BROOKLYN,,SOUTH  PRESBYTERIAN CH,
105 Water N Y h Sackett b Court and Clinton,Assume,105 WATER N Y H SACKETT B COURT AND CLINTON,105,WATER N Y H SACKETT B COURT AND CLINTON,,,,,,h in between,,SACKETT,,CLINTON,B COURT AND,,,,,105,WATER,,,,,,N Y,
N Y h 30 Boerum,Assume,N Y H 30 BOERUM,,,N Y H 30 BOERUM,,,,,h in between,30,BOERUM,,,H,,,,,,,,,,,,N Y,
7 DePeyster N Y h 1C7 Adams,Assume,7 DEPEYSTER N Y H 1C7 ADAMS,7,DEPEYSTER N Y H 1C7 ADAMS,,,,,,h in between,,ADAMS,,,1C7,,,,,7,DEPEYSTER,,,,,,N Y,
Atlantic Dock h 112 Harrison,Assume,ATLANTIC DOCK H 112 HARRISON,,,ATLANTIC DOCK H 112 HARRISON,,,,,h in between,,112,HARRIS,,ON,,,,,,ATLANTIC DOCK,,,,,,,
Plymouth c Bridge h 189 Front,Assume,PLYMOUTH C BRIDGE H 189 FRONT,,,PLYMOUTH C BRIDGE H 189 FRONT,,,,,h in between,189,FRONT,,,H,,,,,,PLYMOUTH,,,,,,C BRIDGE,
32 Liberty NY h Warren n Smith,Assume,32 LIBERTY NY H WARREN N SMITH,32,LIBERTY NY H WARREN N SMITH,,,,,,h in between,,WARREN,,,N SMITH,,,,,32,LIBERTY,,,,NY,,,
gold pea manufân 2 Maiden lane N Y h 41 Dean,Assume,GOLD PEA MANUFÂN 2 MAIDEN LANE N Y H 41 DEAN,,,GOLD PEA MANUFâN 2 MAIDEN LANE N Y H 41 DEAN,,,,,h in between,41,DEAN,,,H,,,,,,MAIDEN LA,,,,,,GOLD PEA MANUFÂN 2 NE N Y,
23 Water N Y h 47 Willow,Assume,23 WATER N Y H 47 WILLOW,23,WATER N Y H 47 WILLOW,,,,,,h in between,47,WILLOW,,,H,,,,,23,WATER,,,,,,N Y,
D D pastor 2d Presbyterian ch h 104 Pineapple,Assume,D D PASTOR 2D PRESBYTERIAN CH H 104 PINEAPPLE,,,D D PASTOR 2D PRESBYTERIAN CH H 104 PINEAPPLE,,,,,h in between,104,PINEAPPLE,,,H,,,,,,2,,,,,,D D PASTOR D PRESBYTERIAN CH,
mer. N Y h Remsen c Clinton,Assume,MER. N Y H REMSEN C CLINTON,,,MER. N Y H REMSEN C CLINTON,,,,,h in between,,CLINTON,,,REMSEN C,,,,,,,,,,,,MER. N Y,
18 Maiden lane N Y h 35,Assume,18 MAIDEN LANE N Y H 35,18,MAIDEN LANE N Y H 35,,,,,,h in between,,35,,,H,,,,,18,MAIDEN LA,,,,,,NE N Y,
IS Maiden Jane NY h 34 Willow Prospect,Assume,IS MAIDEN JANE NY H 34 WILLOW PROSPECT,,,IS MAIDEN JANE NY H 34 WILLOW PROSPECT,,,,,h in between,34,W PROSPECT,,,WILLO,,,,,,JANE,,,,NY,,IS MAIDEN,
Panama railroad Co. 78 Broadway N Y h 31 Johnson,Assume,PANAMA RAILROAD CO. 78 BROADWAY N Y H 31 JOHNSON,,,PANAMA RAILROAD CO. 78 BROADWAY N Y H 31 JOHNSON,,,,,h in between,31,JOHNSON,,,H,,,,,,BROADWAY,,,,PANAMA,,RAILROAD CO. 78  N Y,
mer. N Y h Colonade row Columbia u Middagh,Assume,MER. N Y H COLONADE ROW COLUMBIA U MIDDAGH,,,MER. N Y H COLONADE ROW COLUMBIA U MIDDAGH,,,,,h in between,,COLUMBIA,,,COLONADE ROW  U MIDDAGH,,,,,,,,,,,,MER. N Y,
3 Front h 153 Adams,Assume,3 FRONT H 153 ADAMS,3,FRONT H 153 ADAMS,,,,,,h in between,153,ADAMS,,,H,,,,,3,FRONT,,,,,,,
18 Dutch st N Y h 41 Front,Assume,18 DUTCH ST N Y H 41 FRONT,18,DUTCH ST N Y H 41 FRONT,,,,,,h in between,41,FRONT,,,H,,,,,18,DUTCH,,,,,,ST N Y,
City bank N Y h YVashington n Jamaica av,Assume,CITY BANK N Y H YVASHINGTON N JAMAICA AV,,,CITY BANK N Y H YVASHINGTON N JAMAICA AV,,,,,h in between,,ASH,JAMAICA,,YVINGTON N  AV,,,,,,BANK,,,,,,CITY  N Y,
76 Broad N Y h 69 Pierrepont,Assume,76 BROAD N Y H 69 PIERREPONT,76,BROAD N Y H 69 PIERREPONT,,,,,,h in between,69,PIERREPONT,,,H,,,,,76,BROAD,,,,,,N Y,
119 Maiden lane N Y h Adeiphi st n Myrtle av,Assume,119 MAIDEN LANE N Y H ADEIPHI ST N MYRTLE AV,119,MAIDEN LANE N Y H ADEIPHI ST N MYRTLE AV,,,,,,h in between,,,,,ADEIPHI ST N MYRTLE AV,,,,,119,MAIDEN LA,,,,,,NE N Y,
"51 Exchange pl N Y h State n Powers BROOKLYN DIRECTORY ,",Assume,"51 EXCHANGE PL N Y H STATE N POWERS BROOKLYN DIRECTORY ,",51,"EXCHANGE PL N Y H STATE N POWERS BROOKLYN DIRECTORY ,",,,,,,h in between,,RECTOR,BROOKLYN,,"STATE N POWERS  DIY ,",,,,,51,EXCHANGE PL,,,,,,N Y,
233 Pearl NY h 276 Jay,Assume,233 PEARL NY H 276 JAY,233,PEARL NY H 276 JAY,,,,,,h in between,276,JAY,,,H,,,,,233,PEARL,,,,NY,,,
41 South William NY h 9,Assume,41 SOUTH WILLIAM NY H 9,41,SOUTH WILLIAM NY H 9,,,,,,h in between,,9,,,H,,,,,41,WILLIAM,,,,NY,,SOUTH,
43 Fulton h 3d av n 34th st NY' Cheever pl,Assume,43 FULTON H 3D AV N 34TH ST NY' CHEEVER PL,43,FULTON H 3D AV N 34TH ST NY' CHEEVER PL,,,,,,h in between,,CHEEVER PL,NY,,3D AV N 34TST ',,,,,43,FULTON,,,,,,,
Fulton market NY' h 196 High,Assume,FULTON MARKET NY' H 196 HIGH,,,FULTON MARKET NY' H 196 HIGH,,,,,h in between,196,HIGH,,,H,,,,,,FULTON MARKET,,,,NY,,',
NY h 176 Clinton n Degraw,Assume,NY H 176 CLINTON N DEGRAW,,,NY H 176 CLINTON N DEGRAW,,,,,h in between,176,CLINTON,,,N DEGRAW,,,,,,,,,,NY,,,
attorney at law and commissioner of deeds Freeman Buildings 291 Fulton h 12. Fulton,Assume,ATTORNEY AT LAW AND COMMISSIONER OF DEEDS FREEMAN BUILDINGS 291 FULTON H 12. FULTON,,,ATTORNEY AT LAW AND COMMISSIONER OF DEEDS FREEMAN BUILDINGS 291 FULTON H 12. FULTON,,,,,h in between,,FULTON,,,12,,,,,,ATTORNEY,,,,,FULTON,AT LAW AND COMMISSIONER OF DEEDS FREEMAN BUILDINGS 291,
N Y h 211 Washington,Assume,N Y H 211 WASHINGTON,,,N Y H 211 WASHINGTON,,,,,h in between,211,WASHINGTON,,,H,,,,,,,,,,,,N Y,
coffee dealer c Washington & Vesey st-s N Y h Dean c Court,Assume,COFFEE DEALER C WASHINGTON & VESEY STS N Y H DEAN C COURT,,,COFFEE DEALER C WASHINGTON & VESEY ST-S N Y H DEAN C COURT,,,,,h in between,,DEAN,,,C COURT,,,,,,WASHINGTON,,,,DEAL,,COFFEE ER C  & VESEY STS N Y,
8 Cedar NY h 6 Garden,Assume,8 CEDAR NY H 6 GARDEN,8,CEDAR NY H 6 GARDEN,,,,,,h in between,6,GARDEN,,,H,,,,,8,CEDAR,,,,NY,,,
8 Cedar NY h 6 Garden,Assume,8 CEDAR NY H 6 GARDEN,8,CEDAR NY H 6 GARDEN,,,,,,h in between,6,GARDEN,,,H,,,,,8,CEDAR,,,,NY,,,
8 Cedar NY h 230 Atlantic,Assume,8 CEDAR NY H 230 ATLANTIC,8,CEDAR NY H 230 ATLANTIC,,,,,,h in between,230,ATLANTIC,,,H,,,,,8,CEDAR,,,,NY,,,
NY h 237 Hicks,Assume,NY H 237 HICKS,,,NY H 237 HICKS,,,,,h in between,237,HICKS,,,H,,,,,,,,,,NY,,,
25 Wall NY h 230 Atlantic,Assume,25 WALL NY H 230 ATLANTIC,25,WALL NY H 230 ATLANTIC,,,,,,h in between,230,ATLANTIC,,,H,,,,,25,WALL,,,,NY,,,
"39 Broadway NY'"" h 10 Cottage row Furman st",Assume,"39 BROADWAY NY'"" H 10 COTTAGE ROW FURMAN ST",39,"BROADWAY NY'"" H 10 COTTAGE ROW FURMAN ST",,,,,,h in between,10,FURMAN,,,COTTAGE ROW  ST,,,,,39,BROADWAY,,,,NY,,"'""",
St Peterâs church h Bond n Pacific,Assume,ST PETERÂS CHURCH H BOND N PACIFIC,,,ST PETERâS CHURCH H BOND N PACIFIC,,,,,h in between,,PACIFIC,,,BOND N,,,,,,CHURCH,,,,,,ST PETERÂS,
130 Atlantic c Henry h Court n Pacific,Assume,130 ATLANTIC C HENRY H COURT N PACIFIC,130,ATLANTIC C HENRY H COURT N PACIFIC,,,,,,h in between,,PACIFIC,,,COURT N,,,,,130,ATLANTIC,,,,,,C HENRY,
107 Broad st N Y h 10 Union st,Assume,107 BROAD ST N Y H 10 UNION ST,107,BROAD ST N Y H 10 UNION ST,,,,,,h in between,10,UNION,,,ST,,,,,107,BROAD,,,,,,ST N Y,
155 Pearl N Y h 37 Livingston,Assume,155 PEARL N Y H 37 LIVINGSTON,155,PEARL N Y H 37 LIVINGSTON,,,,,,h in between,37,LIVINGSTON,,,H,,,,,155,PEARL,,,,,,N Y,
16 Cliff st N Y h Clinton n DeKalb av,Assume,16 CLIFF ST N Y H CLINTON N DEKALB AV,16,CLIFF ST N Y H CLINTON N DEKALB AV,,,,,,h in between,,CLINTON,,,N DEKALB AV,,,,,16,CLIFF,,,,,,ST N Y,
305 Pearl N Y h 34 Willoughby,Assume,305 PEARL N Y H 34 WILLOUGHBY,305,PEARL N Y H 34 WILLOUGHBY,,,,,,h in between,34,WILLOUGHBY,,,H,,,,,305,PEARL,,,,,,N Y,
1 Tillary h 70 Prince,Assume,1 TILLARY H 70 PRINCE,1,TILLARY H 70 PRINCE,,,,,,h in between,70,PRINCE,,,H,,,,,1,TILLARY,,,,,,,
101 Broad st N Y h 112 Smith,Assume,101 BROAD ST N Y H 112 SMITH,101,BROAD ST N Y H 112 SMITH,,,,,,h in between,112,SMITH,,,H,,,,,101,BROAD,,,,,,ST N Y,
77 Sands c Jay h 55 Willow,Assume,77 SANDS C JAY H 55 WILLOW,77,SANDS C JAY H 55 WILLOW,,,,,,h in between,55,WILLOW,,,H,,,,,77,SANDS,,,,,,C JAY,
Freeman buildings 291 Fulton h 59 Johnson,Assume,FREEMAN BUILDINGS 291 FULTON H 59 JOHNSON,,,FREEMAN BUILDINGS 291 FULTON H 59 JOHNSON,,,,,h in between,59,JOHNSON,,,H,,,,,,FREEMAN,,,,,FULTON,BUILDINGS 291,
81 Dey st N Y h 92 Duffield,Assume,81 DEY ST N Y H 92 DUFFIELD,81,DEY ST N Y H 92 DUFFIELD,,,,,,h in between,92,DUFFIELD,,,H,,,,,81,DEY,,,,,,ST N Y,
N Y h 4 Remsen,Assume,N Y H 4 REMSEN,,,N Y H 4 REMSEN,,,,,h in between,4,REMSEN,,,H,,,,,,,,,,,,N Y,
N Y h 88 Willoughby,Assume,N Y H 88 WILLOUGHBY,,,N Y H 88 WILLOUGHBY,,,,,h in between,88,WILLOUGHBY,,,H,,,,,,,,,,,,N Y,
71 Exchange pl N Y h 17 Sackett,Assume,71 EXCHANGE PL N Y H 17 SACKETT,71,EXCHANGE PL N Y H 17 SACKETT,,,,,,h in between,17,SACKETT,,,H,,,,,71,EXCHANGE PL,,,,,,N Y,
245 Pearl N Y h 276 Pearl,Assume,245 PEARL N Y H 276 PEARL,245,PEARL N Y H 276 PEARL,,,,,,h in between,276,PEARL,,,H,,,,,245,PEARL,,,,,,N Y,
162 Fulton h 140 High,Assume,162 FULTON H 140 HIGH,162,FULTON H 140 HIGH,,,,,,h in between,140,HIGH,,,H,,,,,162,FULTON,,,,,,,
162 Fulton 244 Bridge c Johnson h,Assume,162 FULTON 244 BRIDGE C JOHNSON H,162,FULTON 244 BRIDGE C JOHNSON H,,,,,,h in between,,,,,H,,,,,162,JOHNSON,,,,,FULTON,244 BRIDGE C,
203 Jay h 91 Tillary,Assume,203 JAY H 91 TILLARY,203,JAY H 91 TILLARY,,,,,,h in between,91,TILLARY,,,H,,,,,203,JAY,,,,,,,
277 Fulton junc Washington h Flatbush,Assume,277 FULTON JUNC WASHINGTON H FLATBUSH,277,FULTON JUNC WASHINGTON H FLATBUSH,,,,,,h in between,,,FLATBUSH,,H,,,,,277,WASHINGTON,,,,,FULTON,JUNC,
105 and 107 Court h north c Court and Baltic,Assume,105 AND 107 COURT H NORTH C COURT AND BALTIC,105,AND 107 COURT H NORTH C COURT AND BALTIC,,,,,,h in between,,BALTIC,,,NORTC COURT AND,,,,,105,107,,,,,,AND  COURT,
132 and 134 Fulton c Middagh h IDS Fulton,Assume,132 AND 134 FULTON C MIDDAGH H IDS FULTON,132,AND 134 FULTON C MIDDAGH H IDS FULTON,,,,,,h in between,,FULTON,,,IDS,,,,,132,MIDDAGH,,,,,FULTON,AND 134  C,
N Y h 73 Henry,Assume,N Y H 73 HENRY,,,N Y H 73 HENRY,,,,,h in between,73,HENRY,,,H,,,,,,,,,,,,N Y,
N Y h 158 Atlantic,Assume,N Y H 158 ATLANTIC,,,N Y H 158 ATLANTIC,,,,,h in between,158,ATLANTIC,,,H,,,,,,,,,,,,N Y,
