NY h Clinton n Myrtle av,Assume,NY H CLINTON N MYRTLE AV,,,NY H CLINTON N MYRTLE AV,,,,,h in between,,CLINTON,,,N MYRTLE AV,,,,,,,,,,NY,,,
128 Fulton NY7 h Franklin n Park av,Assume,128 FULTON NY7 H FRANKLIN N PARK AV,128,FULTON NY7 H FRANKLIN N PARK AV,,,,,,h in between,,FRANKLIN,,,N PARK AV,,,,,128,FULTON,,,,NY,,7,
55 Cedar N Y h 10 Clark,Assume,55 CEDAR N Y H 10 CLARK,55,CEDAR N Y H 10 CLARK,,,,,,h in between,10,CLARK,,,H,,,,,55,CEDAR,,,,,,N Y,
110 Pearl N Y7 h Cheever place n Harrison,Assume,110 PEARL N Y7 H CHEEVER PLACE N HARRISON,110,PEARL N Y7 H CHEEVER PLACE N HARRISON,,,,,,h in between,,CHEEVER PL,HARRIS,,ACE N ON,,,,,110,PEARL,,,,,,N Y7,
N Y h 57 Willow,Assume,N Y H 57 WILLOW,,,N Y H 57 WILLOW,,,,,h in between,57,WILLOW,,,H,,,,,,,,,,,,N Y,
N Y h 30 Johnson,Assume,N Y H 30 JOHNSON,,,N Y H 30 JOHNSON,,,,,h in between,30,JOHNSON,,,H,,,,,,,,,,,,N Y,
350 Fulton h Schermerhorn n Boerum,Assume,350 FULTON H SCHERMERHORN N BOERUM,350,FULTON H SCHERMERHORN N BOERUM,,,,,,h in between,,SCHERMERHORN,,,N BOERUM,,,,,350,FULTON,,,,,,,
89 Front N Y h 57 Hoyt,Assume,89 FRONT N Y H 57 HOYT,89,FRONT N Y H 57 HOYT,,,,,,h in between,57,HOYT,,,H,,,,,89,FRONT,,,,,,N Y,
82 Wall N Y h 170 Atlantic c Clinton,Assume,82 WALL N Y H 170 ATLANTIC C CLINTON,82,WALL N Y H 170 ATLANTIC C CLINTON,,,,,,h in between,170,ATLANTIC,,CLINTON,C,,,,,82,WALL,,,,,,N Y,
103 h 37 Atlantic,Assume,103 H 37 ATLANTIC,103,H 37 ATLANTIC,,,,,,h in between,37,ATLANTIC,,,H,,,,,,103,,,,,,,
Wall N Y h 43 Wyckoff n Smith,Assume,WALL N Y H 43 WYCKOFF N SMITH,,,WALL N Y H 43 WYCKOFF N SMITH,,,,,h in between,43,WYCKOFF,,,N SMITH,,,,,,WALL,,,,,,N Y,
113 Fulton c Sands h 93 Clark,Assume,113 FULTON C SANDS H 93 CLARK,113,FULTON C SANDS H 93 CLARK,,,,,,h in between,93,CLARK,,,H,,,,,113,FULTON,,,,,,C SANDS,
139 Front N Y h 50 Willow,Assume,139 FRONT N Y H 50 WILLOW,139,FRONT N Y H 50 WILLOW,,,,,,h in between,50,WILLOW,,,H,,,,,139,FRONT,,,,,,N Y,
43 Main h 75 Prospect c Jay,Assume,43 MAIN H 75 PROSPECT C JAY,43,MAIN H 75 PROSPECT C JAY,,,,,,h in between,75,PROSPECT,,,C JAY,,,,,43,MAIN,,,,,,,
174 Gold h 171 Johnson,Assume,174 GOLD H 171 JOHNSON,174,GOLD H 171 JOHNSON,,,,,,h in between,171,JOHNSON,,,H,,,,,174,GOLD,,,,,,,
N Y h 24 Clinton,Assume,N Y H 24 CLINTON,,,N Y H 24 CLINTON,,,,,h in between,24,CLINTON,,,H,,,,,,,,,,,,N Y,
28 Ferry N Y h 70 Columbia,Assume,28 FERRY N Y H 70 COLUMBIA,28,FERRY N Y H 70 COLUMBIA,,,,,,h in between,70,COLUMBIA,,,H,,,,,28,FERRY,,,,,,N Y,
61 Beaver st N Y h 64 Baltic,Assume,61 BEAVER ST N Y H 64 BALTIC,61,BEAVER ST N Y H 64 BALTIC,,,,,,h in between,64,BALTIC,,,H,,,,,61,BEAVER,,,,,,ST N Y,
Middagh c Fulton h 78 Poplar,Assume,MIDDAGH C FULTON H 78 POPLAR,,,MIDDAGH C FULTON H 78 POPLAR,,,,,h in between,78,POPLAR,,,H,,,,,,MIDDAGH,,,,,FULTON,C,
Columbia c VanBrunt h Union c Carroll,Assume,COLUMBIA C VANBRUNT H UNION C CARROLL,,,COLUMBIA C VANBRUNT H UNION C CARROLL,,,,,h in between,,CARROLL,,UNION,C,,,,,,COLUMBIA,,,,,,C VANBRUNT,
York st M E church h 151 York,Assume,YORK ST M E CHURCH H 151 YORK,,,YORK ST M E CHURCH H 151 YORK,,,,,h in between,151,YORK,,,H,,,,,,CHURCH,,,,,,YORK ST M E,
N Y h 81 Pineapple,Assume,N Y H 81 PINEAPPLE,,,N Y H 81 PINEAPPLE,,,,,h in between,81,PINEAPPLE,,,H,,,,,,,,,,,,N Y,
Freemans Buildings 291 Fulton h 1 Willoughby,Assume,FREEMANS BUILDINGS 291 FULTON H 1 WILLOUGHBY,,,FREEMANS BUILDINGS 291 FULTON H 1 WILLOUGHBY,,,,,h in between,1,WILLOUGHBY,,,H,,,,,,FREEMAN,,,,,FULTON,S BUILDINGS 291,
226 Fulton h 8S Tillary,Assume,226 FULTON H 8S TILLARY,226,FULTON H 8S TILLARY,,,,,,h in between,,TILLARY,,,8S,,,,,226,FULTON,,,,,,,
N Y h 5 Union,Assume,N Y H 5 UNION,,,N Y H 5 UNION,,,,,h in between,5,UNION,,,H,,,,,,,,,,,,N Y,
Jay c Concord h 27 Chapel,Assume,JAY C CONCORD H 27 CHAPEL,,,JAY C CONCORD H 27 CHAPEL,,,,,h in between,27,CHAPEL,,,H,,,,,,CONCORD,,,,,,JAY C,
64 Washington c Front h 165 Front,Assume,64 WASHINGTON C FRONT H 165 FRONT,64,WASHINGTON C FRONT H 165 FRONT,,,,,,h in between,165,FRONT,,,H,,,,,64,WASHINGTON,,,,,,C FRONT,
"Leary Timothy,junk dealer c Maiden lane and Water N Y h 8 Sackett",Assume,"LEARY TIMOTHY,JUNK DEALER C MAIDEN LANE AND WATER N Y H 8 SACKETT",,,"LEARY TIMOTHY,JUNK DEALER C MAIDEN LANE AND WATER N Y H 8 SACKETT",,,,,h in between,8,SACKETT,,,H,,,,,,MAIDEN LA,,,,DEAL,,"LEARY TIMOTHY,JUNK ER C NE AND WATER N Y",
101 Fulton h Franklin house,Assume,101 FULTON H FRANKLIN HOUSE,101,FULTON H FRANKLIN HOUSE,,,,,,h in between,,FRANKLIN,,,HOUSE,,,,,101,FULTON,,,,,,,
160 Front NY h 104 Willow,Assume,160 FRONT NY H 104 WILLOW,160,FRONT NY H 104 WILLOW,,,,,,h in between,104,WILLOW,,,H,,,,,160,FRONT,,,,NY,,,
Navy Y'ard h 261 Bridge,Assume,NAVY Y'ARD H 261 BRIDGE,,,NAVY Y'ARD H 261 BRIDGE,,,,,h in between,261,RIDGE,,,B,,,,,,NAVY,,,,,,Y'ARD,
160 Atlantic h 166,Assume,160 ATLANTIC H 166,160,ATLANTIC H 166,,,,,,h in between,,166,,,H,,,,,160,ATLANTIC,,,,,,,
Plymouth c Bridge h 105 Gold,Assume,PLYMOUTH C BRIDGE H 105 GOLD,,,PLYMOUTH C BRIDGE H 105 GOLD,,,,,h in between,105,GOLD,,,H,,,,,,PLYMOUTH,,,,,,C BRIDGE,
102 Wall st N Y h 151 Jay,Assume,102 WALL ST N Y H 151 JAY,102,WALL ST N Y H 151 JAY,,,,,,h in between,151,JAY,,,H,,,,,102,WALL,,,,,,ST N Y,
45 Fulton 9th ward) h Bedford corners,Assume,45 FULTON 9TH WARD) H BEDFORD CORNERS,45,FULTON 9TH WARD) H BEDFORD CORNERS,,,,,,h in between,,,BEDFORD CORNERS,,H,,,,,45,FULTON,,,,,,9TH WARD),
9 Maiden lane N Y h 84 Pineapple,Assume,9 MAIDEN LANE N Y H 84 PINEAPPLE,9,MAIDEN LANE N Y H 84 PINEAPPLE,,,,,,h in between,84,PINEAPPLE,,,H,,,,,9,MAIDEN LA,,,,,,NE N Y,
"121 Broad NY h 10 Degraw l,eonard Samuel B , sash & b)ind maker , Myrtle av n Bridge",Assume,"121 BROAD NY H 10 DEGRAW L,EONARD SAMUEL B , SASH & B)IND MAKER , MYRTLE AV N BRIDGE",121,"BROAD NY H 10 DEGRAW L,EONARD SAMUEL B , SASH & B)IND MAKER , MYRTLE AV N BRIDGE",,,,,,h in between,10,DEGRAW,,,"L,EONARD SAMUEL B , SAS& B)IND MAKER , MYRTLE AV N BRIDGE",,,,,121,BROAD,,,,NY,,,
24 Liberty N Y h 46 Sydney p]ace,Assume,24 LIBERTY N Y H 46 SYDNEY P]ACE,24,LIBERTY N Y H 46 SYDNEY P]ACE,,,,,,h in between,,46,,,SYDNEY P]ACE,,,,,24,LIBERTY,,,,,,N Y,
155 Broadway N Y h 21 Front,Assume,155 BROADWAY N Y H 21 FRONT,155,BROADWAY N Y H 21 FRONT,,,,,,h in between,21,FRONT,,,H,,,,,155,BROADWAY,,,,,,N Y,
"auctioneer and general agency office , Fulton c Tillary h Powers n Schermerhorn",Assume,"AUCTIONEER AND GENERAL AGENCY OFFICE , FULTON C TILLARY H POWERS N SCHERMERHORN",,,"AUCTIONEER AND GENERAL AGENCY OFFICE , FULTON C TILLARY H POWERS N SCHERMERHORN",,,,,h in between,,SCHERMERHORN,,,POWERS N,,,,,,TILLARY,,,,,FULTON,"AUCTIONEER AND GENERAL AGENCY OFFICE ,  C",
13 Cedar N Y h 117 Clinton,Assume,13 CEDAR N Y H 117 CLINTON,13,CEDAR N Y H 117 CLINTON,,,,,,h in between,117,CLINTON,,,H,,,,,13,CEDAR,,,,,,N Y,
"inspector of pot and , Pearl ash 49 West N Y h 155 Clinton",Assume,"INSPECTOR OF POT AND , PEARL ASH 49 WEST N Y H 155 CLINTON",,,"INSPECTOR OF POT AND , PEARL ASH 49 WEST N Y H 155 CLINTON",,,,,h in between,155,CLINTON,,,H,,,,,,PEARL,,,,,,"INSPECTOR OF POT AND ,  ASH 49 WEST N Y",
"brick yard foot of , Joralemon h 33 Baltic",Assume,"BRICK YARD FOOT OF , JORALEMON H 33 BALTIC",,,"BRICK YARD FOOT OF , JORALEMON H 33 BALTIC",,,,,h in between,33,BALTIC,,,H,,,,,,JORALEMON,,,,BRICK,,"YARD FOOT OF ,",
"49 Nassau CH DANIEL T , grocer 31 James h 39 York",Assume,"49 NASSAU CH DANIEL T , GROCER 31 JAMES H 39 YORK",49,"NASSAU CH DANIEL T , GROCER 31 JAMES H 39 YORK",,,,,,h in between,39,YORK,,,H,,,,,49,NASSAU,,,,,,"CH DANIEL T , GROCER 31 JAMES",
National Bk NY h 154 Washington place Water c Main,Assume,NATIONAL BK NY H 154 WASHINGTON PLACE WATER C MAIN,,,NATIONAL BK NY H 154 WASHINGTON PLACE WATER C MAIN,,,,,h in between,154,WASHINGTON PL,,,ACE WATER C MAIN,,,,,,,,,,TIONA,,NAL BK NY,
62 Front N Y h 62 Schermerhorn,Assume,62 FRONT N Y H 62 SCHERMERHORN,62,FRONT N Y H 62 SCHERMERHORN,,,,,,h in between,62,SCHERMERHORN,,,H,,,,,62,FRONT,,,,,,N Y,
164 Fulton h 4 Liberty,Assume,164 FULTON H 4 LIBERTY,164,FULTON H 4 LIBERTY,,,,,,h in between,4,LIBERTY,,,H,,,,,164,FULTON,,,,,,,
213 Fulton op Clinton h 248 Fulton,Assume,213 FULTON OP CLINTON H 248 FULTON,213,FULTON OP CLINTON H 248 FULTON,,,,,,h in between,248,FULTON,,,H,,,,,213,CLINTON,,,,,FULTON,OP,
Nassau and Pine N Y h 60 State,Assume,NASSAU AND PINE N Y H 60 STATE,,,NASSAU AND PINE N Y H 60 STATE,,,,,h in between,60,STATE,,,H,,,,,,NASSAU,,,,,,AND PINE N Y,
NY h 192 Washington,Assume,NY H 192 WASHINGTON,,,NY H 192 WASHINGTON,,,,,h in between,192,WASHINGTON,,,H,,,,,,,,,,NY,,,
200 Fulton h 213,Assume,200 FULTON H 213,200,FULTON H 213,,,,,,h in between,,213,,,H,,,,,200,FULTON,,,,,,,
attorney and counsellor at law and commissioner of deeds Atlantic c Henry h 125 Dean b,Assume,ATTORNEY AND COUNSELLOR AT LAW AND COMMISSIONER OF DEEDS ATLANTIC C HENRY H 125 DEAN B,,,ATTORNEY AND COUNSELLOR AT LAW AND COMMISSIONER OF DEEDS ATLANTIC C HENRY H 125 DEAN B,,,,,h in between,125,DEAN,,,B,,,,,,ATTORNEY,,,,,ATLANTIC,AND COUNSELLOR AT LAW AND COMMISSIONER OF DEEDS  C HENRY,
118 and 120 Maiden lane N Y h 4 Liberty,Assume,118 AND 120 MAIDEN LANE N Y H 4 LIBERTY,118,AND 120 MAIDEN LANE N Y H 4 LIBERTY,,,,,,h in between,4,LIBERTY,,,H,,,,,118,MAIDEN LA,,,,,,AND 120 NE N Y,
Church of the Holy Trinity h Montague place adjoining church,Assume,CHURCH OF THE HOLY TRINITY H MONTAGUE PLACE ADJOINING CHURCH,,,CHURCH OF THE HOLY TRINITY H MONTAGUE PLACE ADJOINING CHURCH,,,,,h in between,,MONTAGUE,,,PLACE ADJOINING CHURCH,,,,,,TRINITY,,,,,,CHURCH OF THE HOLY,
25 Broad N Y h 20 Butler,Assume,25 BROAD N Y H 20 BUTLER,25,BROAD N Y H 20 BUTLER,,,,,,h in between,20,BUTLER,,,H,,,,,25,BROAD,,,,,,N Y,
N Y h 43 York,Assume,N Y H 43 YORK,,,N Y H 43 YORK,,,,,h in between,43,YORK,,,H,,,,,,,,,,,,N Y,
N Y h 7 James,Assume,N Y H 7 JAMES,,,N Y H 7 JAMES,,,,,h in between,7,JAMES,,,H,,,,,,,,,,,,N Y,
43 Water Alderman 6th ward) 58 Pearl N Y h 19,Assume,43 WATER ALDERMAN 6TH WARD) 58 PEARL N Y H 19,43,WATER ALDERMAN 6TH WARD) 58 PEARL N Y H 19,,,,,,h in between,,19,,,H,,,,,43,WATER,,,,ERMA,,ALDN 6TH WARD) 58 PEARL N Y,
"Bedford av n Willoughby l,ittle Charlcs H,143 Atlantic",Assume,ITTLE CHARLCS H 143 ATLANTIC,,,ITTLE CHARLCS H 143 ATLANTIC,"Bedford av n Willoughby l,ittle Charlcs H",,,"Bedford av n Willoughby l,ittle Charlcs H",h in between,143,ATLANTIC,,,H,,,,,,,,,,,,ITTLE CHARLCS,
101 Willoughby c Gold h 108,Assume,101 WILLOUGHBY C GOLD H 108,101,WILLOUGHBY C GOLD H 108,,,,,,h in between,,108,,,H,,,,,101,WILLOUGHBY,,,,,,C GOLD,
S3 Cedar N Y h 56 Pacific,Assume,S3 CEDAR N Y H 56 PACIFIC,,,S3 CEDAR N Y H 56 PACIFIC,,,,,h in between,56,PACIFIC,,,H,,,,,,CEDAR,,,,,,S3  N Y,
N Y h 48 Livingston,Assume,N Y H 48 LIVINGSTON,,,N Y H 48 LIVINGSTON,,,,,h in between,48,LIVINGSTON,,,H,,,,,,,,,,,,N Y,
146 Water N Y h 52 Joralemon,Assume,146 WATER N Y H 52 JORALEMON,146,WATER N Y H 52 JORALEMON,,,,,,h in between,52,JORALEMON,,,H,,,,,146,WATER,,,,,,N Y,
Marshall n Gold h 109 Jay,Assume,MARSHALL N GOLD H 109 JAY,,,MARSHALL N GOLD H 109 JAY,,,,,h in between,109,JAY,,,H,,,,,,MARSHALL,,,,,,N GOLD,
53 Cedar N Y h 92 Sackett,Assume,53 CEDAR N Y H 92 SACKETT,53,CEDAR N Y H 92 SACKETT,,,,,,h in between,92,SACKETT,,,H,,,,,53,CEDAR,,,,,,N Y,
N Y h 77 Middagh,Assume,N Y H 77 MIDDAGH,,,N Y H 77 MIDDAGH,,,,,h in between,77,MIDDAGH,,,H,,,,,,,,,,,,N Y,
Hotel 5 Hamilton av n the ferry h 9 Union,Assume,HOTEL 5 HAMILTON AV N THE FERRY H 9 UNION,5,HAMILTON AV N THE FERRY H 9 UNION,,,,,,h in between,9,UNION,,,H,,,,,5,HAMILTON,,,,,,HOTEL   AV N THE FERRY,
3 Front h Flatbush,Assume,3 FRONT H FLATBUSH,3,FRONT H FLATBUSH,,,,,,h in between,,,FLATBUSH,,H,,,,,3,FRONT,,,,,,,
48 Fulton h 27,Assume,48 FULTON H 27,48,FULTON H 27,,,,,,h in between,,27,,,H,,,,,48,FULTON,,,,,,,
61 Broad N Y h 62 Harrison,Assume,61 BROAD N Y H 62 HARRISON,61,BROAD N Y H 62 HARRISON,,,,,,h in between,,62,HARRIS,,ON,,,,,61,BROAD,,,,,,N Y,
Columbia c Pacific h 27 Cottage row Furman,Assume,COLUMBIA C PACIFIC H 27 COTTAGE ROW FURMAN,,,COLUMBIA C PACIFIC H 27 COTTAGE ROW FURMAN,,,,,h in between,27,FURMAN,,,COTTAGE ROW,,,,,,COLUMBIA,,,,,,C PACIFIC,
Willoughby h Bedford av and Skillman 6t,Assume,WILLOUGHBY H BEDFORD AV AND SKILLMAN 6T,,,WILLOUGHBY H BEDFORD AV AND SKILLMAN 6T,,,,,h in between,,SKILLMAN,,,BEDFORD AV AND  6T,,,,,,WILLOUGHBY,,,,,,,
69 Water N Y h 110 Smith,Assume,69 WATER N Y H 110 SMITH,69,WATER N Y H 110 SMITH,,,,,,h in between,110,SMITH,,,H,,,,,69,WATER,,,,,,N Y,
13 Broadway N Y h 43 Sydney place,Assume,13 BROADWAY N Y H 43 SYDNEY PLACE,13,BROADWAY N Y H 43 SYDNEY PLACE,,,,,,h in between,,43,,,SYDNEY PLACE,,,,,13,BROADWAY,,,,,,N Y,
N Y h 165 Washington,Assume,N Y H 165 WASHINGTON,,,N Y H 165 WASHINGTON,,,,,h in between,165,WASHINGTON,,,H,,,,,,,,,,,,N Y,
219 Water N Y h 47 Nassau,Assume,219 WATER N Y H 47 NASSAU,219,WATER N Y H 47 NASSAU,,,,,,h in between,47,NASSAU,,,H,,,,,219,WATER,,,,,,N Y,
8 Fletcher N Y h 40 Concord,Assume,8 FLETCHER N Y H 40 CONCORD,8,FLETCHER N Y H 40 CONCORD,,,,,,h in between,40,CONCORD,,,H,,,,,8,FLETCHER,,,,,,N Y,
1 Front N Y h S Harrison,Assume,1 FRONT N Y H S HARRISON,1,FRONT N Y H S HARRISON,,,,,,h in between,,,HARRIS,,S ON,,,,,1,FRONT,,,,,,N Y,
w'atchmaker 89 Fulton h 225 Jay,Assume,W'ATCHMAKER 89 FULTON H 225 JAY,89,FULTON H 225 JAY,,,,,,h in between,225,JAY,,,H,,,,,89,FULTON,,,,,,W'ATCHMAKER,
57 Fulton h 3 Montague pl,Assume,57 FULTON H 3 MONTAGUE PL,57,FULTON H 3 MONTAGUE PL,,,,,,h in between,3,MONTAGUE,,,PL,,,,,57,FULTON,,,,,,,
198 Fulton h 71 Pineapple,Assume,198 FULTON H 71 PINEAPPLE,198,FULTON H 71 PINEAPPLE,,,,,,h in between,71,PINEAPPLE,,,H,,,,,198,FULTON,,,,,,,
Fulton c Orange h 94 Clinton,Assume,FULTON C ORANGE H 94 CLINTON,,,FULTON C ORANGE H 94 CLINTON,,,,,h in between,94,CLINTON,,,H,,,,,,FULTON,,,,,ORANGE,C,
IS Broad N Y h 93 Pierrepont,Assume,IS BROAD N Y H 93 PIERREPONT,,,IS BROAD N Y H 93 PIERREPONT,,,,,h in between,93,PIERREPONT,,,H,,,,,,BROAD,,,,,,IS  N Y,
Bridge n Plymouth h 106 Hudson av,Assume,BRIDGE N PLYMOUTH H 106 HUDSON AV,,,BRIDGE N PLYMOUTH H 106 HUDSON AV,,,,,h in between,106,HUDSON,,,AV,,,,,,PLYMOUTH,,,,,,BRIDGE N,
Amity c Hicks h 106 Hudson av,Assume,AMITY C HICKS H 106 HUDSON AV,,,AMITY C HICKS H 106 HUDSON AV,,,,,h in between,106,HUDSON,,,AV,,,,,,HICKS,,,,,,AMITY C,
102 Gold c York h 96 Gold,Assume,102 GOLD C YORK H 96 GOLD,102,GOLD C YORK H 96 GOLD,,,,,,h in between,96,GOLD,,,H,,,,,102,YORK,,,,,,GOLD C,
Fulton c Pineapple h 193 W'ashington,Assume,FULTON C PINEAPPLE H 193 W'ASHINGTON,,,FULTON C PINEAPPLE H 193 W'ASHINGTON,,,,,h in between,193,ASH,,,W'INGTON,,,,,,PINEAPPLE,,,,,FULTON,C,
97 Wall N Y h 24 Schermerhorn,Assume,97 WALL N Y H 24 SCHERMERHORN,97,WALL N Y H 24 SCHERMERHORN,,,,,,h in between,24,SCHERMERHORN,,,H,,,,,97,WALL,,,,,,N Y,
16 Atlantic h 4 Joralemon,Assume,16 ATLANTIC H 4 JORALEMON,16,ATLANTIC H 4 JORALEMON,,,,,,h in between,4,JORALEMON,,,H,,,,,16,ATLANTIC,,,,,,,
27y.5 h 30 Front,Assume,27Y.5 H 30 FRONT,,,27Y.5 H 30 FRONT,,,,,h in between,30,FRONT,,,H,,,,,,27,,,,,,Y,27Y.5
27 Beaver N Y h 99 Hicks,Assume,27 BEAVER N Y H 99 HICKS,27,BEAVER N Y H 99 HICKS,,,,,,h in between,99,HICKS,,,H,,,,,27,BEAVER,,,,,,N Y,
27 Beaver N Y h 99 Hicks,Assume,27 BEAVER N Y H 99 HICKS,27,BEAVER N Y H 99 HICKS,,,,,,h in between,99,HICKS,,,H,,,,,27,BEAVER,,,,,,N Y,
3d av c 21st st h 22nd st b 3rd and 4th av Gowanus,Assume,3D AV C 21ST ST H 22ND ST B 3RD AND 4TH AV GOWANUS,,,3D AV C 21ST ST H 22ND ST B 3RD AND 4TH AV GOWANUS,,,,,h in between,,AV G,,,22ND ST B 3RD AND 4TOWANUS,,,,,,AV C,,,,,,3D  21ST ST,
Doughty st h 289 Pearl,Assume,DOUGHTY ST H 289 PEARL,,,DOUGHTY ST H 289 PEARL,,,,,h in between,289,PEARL,,,H,,,,,,DOUGHTY,,,,,,ST,
Tillary c Gold h Bridge n Wil. loughby,Assume,TILLARY C GOLD H BRIDGE N WIL. LOUGHBY,,,TILLARY C GOLD H BRIDGE N WIL. LOUGHBY,,,,,h in between,,RIDGE,,,B N WIL. LOUGHBY,,,,,,TILLARY,,,,,,C GOLD,
4 Joneâs lane N Y h 63 Pierrepont,Assume,4 JONEÂS LANE N Y H 63 PIERREPONT,4,JONEâS LANE N Y H 63 PIERREPONT,,,,,,h in between,63,PIERREPONT,,,H,,,,,,4,,,,,,JONEÂS LANE N Y,
N Y h 24 Willow place,Assume,N Y H 24 WILLOW PLACE,,,N Y H 24 WILLOW PLACE,,,,,h in between,24,WILLOW PL,,,ACE,,,,,,,,,,,,N Y,
190 Nassau h 154,Assume,190 NASSAU H 154,190,NASSAU H 154,,,,,,h in between,,154,,,H,,,,,190,NASSAU,,,,,,,
73 Main e York h 52 Nassau c Adams,Assume,73 MAIN E YORK H 52 NASSAU C ADAMS,73,MAIN E YORK H 52 NASSAU C ADAMS,,,,,,h in between,52,NASSAU,,,C ADAMS,,,,,73,YORK,,,,,,MAIN E,
61 Fulton h 91,Assume,61 FULTON H 91,61,FULTON H 91,,,,,,h in between,,91,,,H,,,,,61,FULTON,,,,,,,
Brooklyn Grammar School 129 Atlantic c of Henry h 223 Atlantic,Assume,BROOKLYN GRAMMAR SCHOOL 129 ATLANTIC C OF HENRY H 223 ATLANTIC,,,BROOKLYN GRAMMAR SCHOOL 129 ATLANTIC C OF HENRY H 223 ATLANTIC,,,,,h in between,223,ATLANTIC,,,H,,,,,,ATLANTIC,,,,BROOKLYN,,GRAMMAR SCHOOL 129  C OF HENRY,
N Y h 90 YVashington,Assume,N Y H 90 YVASHINGTON,,,N Y H 90 YVASHINGTON,,,,,h in between,90,ASH,,,YVINGTON,,,,,,,,,,,,N Y,
1 Front h Flatbush,Assume,1 FRONT H FLATBUSH,1,FRONT H FLATBUSH,,,,,,h in between,,,FLATBUSH,,H,,,,,1,FRONT,,,,,,,
113 Broadway NY h 31 Livingston,Assume,113 BROADWAY NY H 31 LIVINGSTON,113,BROADWAY NY H 31 LIVINGSTON,,,,,,h in between,31,LIVINGSTON,,,H,,,,,113,BROADWAY,,,,NY,,,
"saloon and ten pin alley , Bullâs Head tavern Fulton c Hudson av h 194 Bridge",Assume,"SALOON AND TEN PIN ALLEY , BULLÂS HEAD TAVERN FULTON C HUDSON AV H 194 BRIDGE",,,"SALOON AND TEN PIN ALLEY , BULLâS HEAD TAVERN FULTON C HUDSON AV H 194 BRIDGE",,,,,h in between,194,RIDGE,,,B,,,,,,HUDSON,,,,,FULTON,"SALOON AND TEN PIN ALLEY , BULLÂS HEAD TAVERN  C  AV",
54 Wall N Y h 8 Schermerhorn,Assume,54 WALL N Y H 8 SCHERMERHORN,54,WALL N Y H 8 SCHERMERHORN,,,,,,h in between,8,SCHERMERHORN,,,H,,,,,54,WALL,,,,,,N Y,
100 Pineapple h 79 Henry,Assume,100 PINEAPPLE H 79 HENRY,100,PINEAPPLE H 79 HENRY,,,,,,h in between,79,HENRY,,,H,,,,,100,PINEAPPLE,,,,,,,
12 Front N Y h 61 Pacific,Assume,12 FRONT N Y H 61 PACIFIC,12,FRONT N Y H 61 PACIFIC,,,,,,h in between,61,PACIFIC,,,H,,,,,12,FRONT,,,,,,N Y,
12 Front N Y h 61 Pacific,Assume,12 FRONT N Y H 61 PACIFIC,12,FRONT N Y H 61 PACIFIC,,,,,,h in between,61,PACIFIC,,,H,,,,,12,FRONT,,,,,,N Y,
Albion office N Y h 3 James,Assume,ALBION OFFICE N Y H 3 JAMES,,,ALBION OFFICE N Y H 3 JAMES,,,,,h in between,3,JAMES,,,H,,,,,,,,,,ALBION,,OFFICE N Y,
5-7 Maiden lane N Y h 65 Livingston,Assume,57 MAIDEN LANE N Y H 65 LIVINGSTON,,,5-7 MAIDEN LANE N Y H 65 LIVINGSTON,,,,,h in between,65,LIVINGSTON,,,H,,,,,57,MAIDEN LA,,,,,,NE N Y,
II Ferry N Y h 91 Jay,Assume,II FERRY N Y H 91 JAY,,,II FERRY N Y H 91 JAY,,,,,h in between,91,JAY,,,H,,,,,,FERRY,,,,,,II  N Y,
69 Wall N Y h 77 State n Henry,Assume,69 WALL N Y H 77 STATE N HENRY,69,WALL N Y H 77 STATE N HENRY,,,,,,h in between,77,N HENRY,,,STATE,,,,,69,WALL,,,,,,N Y,
tea store 152 Fulton h 88 Tillary,Assume,TEA STORE 152 FULTON H 88 TILLARY,,,TEA STORE 152 FULTON H 88 TILLARY,,,,,h in between,88,TILLARY,,,H,,,,,,FULTON,,,,,,TEA STORE 152,
22 Maiden lane N Y h Amity n Court,Assume,22 MAIDEN LANE N Y H AMITY N COURT,22,MAIDEN LANE N Y H AMITY N COURT,,,,,,h in between,,AMITY,,,N COURT,,,,,22,MAIDEN LA,,,,,,NE N Y,
2 Atlantic h 41 Joralemon,Assume,2 ATLANTIC H 41 JORALEMON,2,ATLANTIC H 41 JORALEMON,,,,,,h in between,41,JORALEMON,,,H,,,,,2,ATLANTIC,,,,,,,
97 Pine N Iâ h 192 Adams,Assume,97 PINE N IÂ H 192 ADAMS,97,PINE N Iâ H 192 ADAMS,,,,,,h in between,192,ADAMS,,,H,,,,,97,PINE,,,,,,N IÂ,
1 South N Y h 35 Bergen,Assume,1 SOUTH N Y H 35 BERGEN,1,SOUTH N Y H 35 BERGEN,,,,,,h in between,35,BERGEN,,,H,,,,,,1,,,,,,SOUTH N Y,
N Y h 98 Willoughby,Assume,N Y H 98 WILLOUGHBY,,,N Y H 98 WILLOUGHBY,,,,,h in between,98,WILLOUGHBY,,,H,,,,,,,,,,,,N Y,
31 York h 24 Front,Assume,31 YORK H 24 FRONT,31,YORK H 24 FRONT,,,,,,h in between,24,FRONT,,,H,,,,,31,YORK,,,,,,,
6 Water n Fulton h Tillary.e Navy,Assume,6 WATER N FULTON H TILLARY.E NAVY,6,WATER N FULTON H TILLARY.E NAVY,,,,,,h in between,,TILLARY,,,.E NAVY,,,,,6,FULTON,,,,,,WATER N,
40 Wall N Y h 19 Atlantic,Assume,40 WALL N Y H 19 ATLANTIC,40,WALL N Y H 19 ATLANTIC,,,,,,h in between,19,ATLANTIC,,,H,,,,,40,WALL,,,,,,N Y,
N Y h 92 Court n Atlantic,Assume,N Y H 92 COURT N ATLANTIC,,,N Y H 92 COURT N ATLANTIC,,,,,h in between,92,ATLANTIC,,,COURT N,,,,,,,,,,,,N Y,
N Y h 59 Nassau,Assume,N Y H 59 NASSAU,,,N Y H 59 NASSAU,,,,,h in between,59,NASSAU,,,H,,,,,,,,,,,,N Y,
County Clerkâs office h 207 Pearl,Assume,COUNTY CLERKÂS OFFICE H 207 PEARL,,,COUNTY CLERKâS OFFICE H 207 PEARL,,,,,h in between,207,PEARL,,,H,,,,,,,,,,,,COUNTY CLERKÂS OFFICE,
102 West st N Y h 308 Atlantic,Assume,102 WEST ST N Y H 308 ATLANTIC,102,WEST ST N Y H 308 ATLANTIC,,,,,,h in between,308,ATLANTIC,,,H,,,,,,102,,,,,,WEST ST N Y,
125 Court h 42 Douglass,Assume,125 COURT H 42 DOUGLASS,125,COURT H 42 DOUGLASS,,,,,,h in between,42,DOUGLASS,,,H,,,,,,125,,,,,,COURT,
24 South N Y h 191 Henry,Assume,24 SOUTH N Y H 191 HENRY,24,SOUTH N Y H 191 HENRY,,,,,,h in between,191,HENRY,,,H,,,,,,24,,,,,,SOUTH N Y,
N Y h 8 Garden,Assume,N Y H 8 GARDEN,,,N Y H 8 GARDEN,,,,,h in between,8,GARDEN,,,H,,,,,,,,,,,,N Y,
57 Atlantic h 11'4 Willoughby,Assume,57 ATLANTIC H 11'4 WILLOUGHBY,57,ATLANTIC H 11'4 WILLOUGHBY,,,,,,h in between,,WILLOUGHBY,,,11'4,,,,,57,ATLANTIC,,,,,,,
131 William N Y h 76 Columbia,Assume,131 WILLIAM N Y H 76 COLUMBIA,131,WILLIAM N Y H 76 COLUMBIA,,,,,,h in between,76,COLUMBIA,,,H,,,,,131,WILLIAM,,,,,,N Y,
N Y h 74 Columbia,Assume,N Y H 74 COLUMBIA,,,N Y H 74 COLUMBIA,,,,,h in between,74,COLUMBIA,,,H,,,,,,,,,,,,N Y,
Bank of New York h 51 Hicks,Assume,BANK OF NEW YORK H 51 HICKS,,,BANK OF NEW YORK H 51 HICKS,,,,,h in between,51,HICKS,,,H,,,,,,,,,,BANK OF NEW YORK,,,
A B C F M 150 Nassau N Y h 143 Adams,Assume,A B C F M 150 NASSAU N Y H 143 ADAMS,,,A B C F M 150 NASSAU N Y H 143 ADAMS,,,,,h in between,143,ADAMS,,,H,,,,,,NASSAU,,,,,,A B C F M 150  N Y,
204 Broadway N Y h 66 Nassau,Assume,204 BROADWAY N Y H 66 NASSAU,204,BROADWAY N Y H 66 NASSAU,,,,,,h in between,66,NASSAU,,,H,,,,,204,BROADWAY,,,,,,N Y,
161 Maiden lane N Y h 11 Monroe pl,Assume,161 MAIDEN LANE N Y H 11 MONROE PL,161,MAIDEN LANE N Y H 11 MONROE PL,,,,,,h in between,11,MONROE PL,,,H,,,,,161,MAIDEN LA,,,,,,NE N Y,
20 Exchange pl N Y h State n Smith,Assume,20 EXCHANGE PL N Y H STATE N SMITH,20,EXCHANGE PL N Y H STATE N SMITH,,,,,,h in between,,STATE,,,N SMITH,,,,,20,EXCHANGE PL,,,,,,N Y,
Atlantic c Hicks h 236 Atlantic,Assume,ATLANTIC C HICKS H 236 ATLANTIC,,,ATLANTIC C HICKS H 236 ATLANTIC,,,,,h in between,236,ATLANTIC,,,H,,,,,,ATLANTIC,,,,,,C HICKS,
60 New st N Y h Union n Court,Assume,60 NEW ST N Y H UNION N COURT,60,NEW ST N Y H UNION N COURT,,,,,,h in between,,UNION,,,N COURT,,,,,60,NEW,,,,,,ST N Y,
73 Atlantic h 67 Chambers N Y,Assume,73 ATLANTIC H 67 CHAMBERS N Y,73,ATLANTIC H 67 CHAMBERS N Y,,,,,,h in between,67,CHAMBERS,,,N Y,,,,,73,ATLANTIC,,,,,,,
53 Beaver N Y h 33 Willow place,Assume,53 BEAVER N Y H 33 WILLOW PLACE,53,BEAVER N Y H 33 WILLOW PLACE,,,,,,h in between,33,WILLOW PL,,,ACE,,,,,53,BEAVER,,,,,,N Y,
3 Market h 1 Henry,Assume,3 MARKET H 1 HENRY,3,MARKET H 1 HENRY,,,,,,h in between,1,HENRY,,,H,,,,,3,MARKET,,,,,,,
105 Concord h 103,Assume,105 CONCORD H 103,105,CONCORD H 103,,,,,,h in between,,103,,,H,,,,,105,CONCORD,,,,,,,
N Y h 59 Livingston,Assume,N Y H 59 LIVINGSTON,,,N Y H 59 LIVINGSTON,,,,,h in between,59,LIVINGSTON,,,H,,,,,,,,,,,,N Y,
lantern manufâr 207 Water N Y h 88 Orange,Assume,LANTERN MANUFÂR 207 WATER N Y H 88 ORANGE,,,LANTERN MANUFâR 207 WATER N Y H 88 ORANGE,,,,,h in between,88,ORANGE,,,H,,,,,,WATER,,,,,,LANTERN MANUFÂR 207  N Y,
39 John N Y' h 82 Henry,Assume,39 JOHN N Y' H 82 HENRY,39,JOHN N Y' H 82 HENRY,,,,,,h in between,82,HENRY,,,H,,,,,39,JOHN,,,,,,N Y',
N Y h 59 Livingston,Assume,N Y H 59 LIVINGSTON,,,N Y H 59 LIVINGSTON,,,,,h in between,59,LIVINGSTON,,,H,,,,,,,,,,,,N Y,
2d Prcsb Ch Court h Joralemon and Livingston,Assume,2D PRCSB CH COURT H JORALEMON AND LIVINGSTON,,,2D PRCSB CH COURT H JORALEMON AND LIVINGSTON,,,,,h in between,,LIVINGSTON,,,JORALEMON AND,,,,,,2,,,,,,D PRCSB CH COURT,
N Y h 59 Livingston,Assume,N Y H 59 LIVINGSTON,,,N Y H 59 LIVINGSTON,,,,,h in between,59,LIVINGSTON,,,H,,,,,,,,,,,,N Y,
N Y h 65 Lawrence,Assume,N Y H 65 LAWRENCE,,,N Y H 65 LAWRENCE,,,,,h in between,65,LAWRENCE,,,H,,,,,,,,,,,,N Y,
39 John N Yâ h 10 Strong pl,Assume,39 JOHN N YÂ H 10 STRONG PL,39,JOHN N Yâ H 10 STRONG PL,,,,,,h in between,10,STRONG PL,,,H,,,,,39,JOHN,,,,,,N YÂ,
39 John N Y h 10 Strong place,Assume,39 JOHN N Y H 10 STRONG PLACE,39,JOHN N Y H 10 STRONG PLACE,,,,,,h in between,10,STRONG PL,,,ACE,,,,,39,JOHN,,,,,,N Y,
finding store 43 Fulton h 316 Gold,Assume,FINDING STORE 43 FULTON H 316 GOLD,,,FINDING STORE 43 FULTON H 316 GOLD,,,,,h in between,316,GOLD,,,H,,,,,,FULTON,,,,,,FINDING STORE 43,
N Y h 5 Warren,Assume,N Y H 5 WARREN,,,N Y H 5 WARREN,,,,,h in between,5,WARREN,,,H,,,,,,,,,,,,N Y,
215 Fulton h 175 Concord,Assume,215 FULTON H 175 CONCORD,215,FULTON H 175 CONCORD,,,,,,h in between,175,CONCORD,,,H,,,,,215,FULTON,,,,,,,
91 Wall N Y h 3 Willoughby,Assume,91 WALL N Y H 3 WILLOUGHBY,91,WALL N Y H 3 WILLOUGHBY,,,,,,h in between,3,WILLOUGHBY,,,H,,,,,91,WALL,,,,,,N Y,
Plymouth c Pearl h 15 Willoughby h S3 Prospect,Assume,PLYMOUTH C PEARL H 15 WILLOUGHBY H S3 PROSPECT,,,PLYMOUTH C PEARL H 15 WILLOUGHBY H S3 PROSPECT,,,,,h in between,15,WILLOUGHBY,,,S3 PROSPECT,,,,,,PLYMOUTH,,,,,,C PEARL,
lamp store 8 Catharine N Y h 36 Prospect,Assume,LAMP STORE 8 CATHARINE N Y H 36 PROSPECT,,,LAMP STORE 8 CATHARINE N Y H 36 PROSPECT,,,,,h in between,36,PROSPECT,,,H,,,,,,E 8,,,,,,LAMP STOR CATHARINE N Y,
114 Front N Y h 5 Wyckoff,Assume,114 FRONT N Y H 5 WYCKOFF,114,FRONT N Y H 5 WYCKOFF,,,,,,h in between,5,WYCKOFF,,,H,,,,,114,FRONT,,,,,,N Y,
96 Pearl N Y h 7 Cheever pl,Assume,96 PEARL N Y H 7 CHEEVER PL,96,PEARL N Y H 7 CHEEVER PL,,,,,,h in between,7,CHEEVER PL,,,H,,,,,96,PEARL,,,,,,N Y,
